,_id,l_id,r_id,l_title,r_title,_sim_score
243,715784,conf/vldb/RossS97,670993,Fast Computation of Sparse Datacubes,Fast Computation of Sparse Datacubes,1.0
244,716824,conf/vldb/GravanoG97,670994,Merging Ranks from Heterogeneous Internet Sources,Merging Ranks from Heterogeneous Internet Sources,1.0
245,716890,conf/vldb/BerckenSW97,671016,A Generic Approach to Bulk Loading Multidimensional Index Structures,A Generic Approach to Bulk Loading Multidimensional Index Structures,1.0
246,718173,conf/vldb/LeeLWS97,671015,A Region Splitting Strategy for Physical Database Design of Multidimensional File Organizations,A Region Splitting Strategy for Physical Database Design of Multidimensional File Organizations,1.0
247,718374,conf/vldb/AtzeniMM97,671014,To Weave the Web,To Weave the Web,1.0
248,719371,conf/vldb/JagadishNSSK97,671013,Incremental Organization for Data Recording and Warehousing,Incremental Organization for Data Recording and Warehousing,1.0
249,720163,conf/vldb/AlonsoHST97,671020,Distributed Processing over Stand-alone Systems and Applications,Distributed Processing over Stand-alone Systems and Applications,1.0
250,721362,conf/vldb/BaralisPT97,671019,Materialized Views Selection in a Multidimensional Database,Materialized Views Selection in a Multidimensional Database,1.0
251,721854,conf/vldb/ShaferA97,671018,Parallel Algorithms for High-dimensional Similarity Joins for Data Mining Applications,Parallel Algorithms for High-dimensional Similarity Joins for Data Mining Applications,1.0
252,722826,conf/vldb/BohannonLRSSS97,671017,Logical and Physical Versioning in Main Memory Databases,Logical and Physical Versioning in Main Memory Databases,1.0
253,724089,conf/vldb/GoldmanW97,671008,DataGuides: Enabling Query Formulation and Optimization in Semistructured Databases,DataGuides: Enabling Query Formulation and Optimization in Semistructured Databases,1.0
254,724553,conf/vldb/ChristodoulakisTZ97,671007,Principles of Optimally Placing Data in Tertiary Storage Libraries,Principles of Optimally Placing Data in Tertiary Storage Libraries,1.0
255,725627,conf/vldb/ZhangL97,671006,Dynamic Memory Adjustment for External Mergesort,Dynamic Memory Adjustment for External Mergesort,1.0
256,726591,conf/vldb/CiacciaPZ97,671005,M-tree: An Efficient Access Method for Similarity Search in Metric Spaces,M-tree: An Efficient Access Method for Similarity Search in Metric Spaces,1.0
257,727738,conf/vldb/DesslochM97,671012,Integrating SQL Databases with Content-Specific Search Engines,Integrating SQL Databases with Content-Specific Search Engines,1.0
258,728397,conf/vldb/BridgeJKLLM97,671011,The Oracle Universal Server Buffer,The Oracle Universal Server Buffer,1.0
259,728965,conf/vldb/SeshadriLR97,671010,The Case for Enhanced Abstract Data Types,The Case for Enhanced Abstract Data Types,1.0
260,730206,conf/vldb/KumarKA97,671009,Caprera: An Activity Framework for Transaction Processing on Wide-Area Networks,Caprera: An Activity Framework for Transaction Processing on Wide-Area Networks,1.0
261,730727,conf/vldb/GraefeBC98,671160,Hash Joins and Hash Teams in Microsoft SQL Server,Hash Joins and Hash Teams in Microsoft SQL Server,1.0
262,731391,conf/vldb/GingrasL98,671161,nD-SQL: A Multi-Dimensional Language for Interoperability and OLAP,nD-SQL: A Multi-Dimensional Language for Interoperability and OLAP,1.0
263,732780,conf/vldb/PapadiasMD98,671163,Algorithms for Querying by Spatial Structure,Algorithms for Querying by Spatial Structure,1.0
264,733250,conf/vldb/Garcia-MolinaLY98,671164,Expiring Data in a Warehouse,Expiring Data in a Warehouse,1.0
265,733958,conf/vldb/OoiGT98,671029,Fast High-Dimensional Data Search in Incomplete Databases,Fast High-Dimensional Data Search in Incomplete Databases,1.0
266,734704,conf/vldb/CarinoJ98,671030,Bank of America Case Study: The Information Currency Advantage,Bank of America Case Study: The Information Currency Advantage,1.0
267,735676,conf/vldb/CarinoO98,671031,Plan-Per-Tuple Optimization Solution - Parallel Execution of Expensive User-Defined Functions,Plan-Per-Tuple Optimization Solution - Parallel Execution of Expensive User-Defined Functions,1.0
268,736188,conf/vldb/LinR98,671033,Querying Continuous Time Sequences,Querying Continuous Time Sequences,1.0
269,737296,conf/vldb/KornLKF98,671025,"Ratio Rules: A New Paradigm for Fast, Quantifiable Data Mining","Ratio Rules: A New Paradigm for Fast, Quantifiable Data Mining",1.0
270,737832,conf/vldb/MuthOPW98,671026,"Design, Implementation, and Performance of the LHAM Log-Structured History Data Access Method","Design, Implementation, and Performance of the LHAM Log-Structured History Data Access Method",1.0
271,738738,conf/vldb/SilversteinBMU98,671027,Scalable Techniques for Mining Causal Structures,Scalable Techniques for Mining Causal Structures,1.0
272,739332,conf/vldb/VenkataramanZ98,671028,Heterogeneous Database Query Optimization in DB2 Universal DataJoiner,Heterogeneous Database Query Optimization in DB2 Universal DataJoiner,1.0
273,740449,conf/vldb/ChavdaW97,671021,Towards an ODMG-Compliant Visual Object Query Language,Towards an ODMG-Compliant Visual Object Query Language,1.0
274,741475,conf/vldb/ChangG97,671022,Effective Memory Use in a Media Server,Effective Memory Use in a Media Server,1.0
275,742060,conf/vldb/BamfordBKM98,671023,Architecture of Oracle Parallel Server,Architecture of Oracle Parallel Server,1.0
276,742625,conf/vldb/OzsuVU98,671024,An Asynchronous Avoidance-Based Cache Consistency Algorithm for Client Caching DBMSs,An Asynchronous Avoidance-Based Cache Consistency Algorithm for Client Caching DBMSs,1.0
277,743285,conf/vldb/ShivakumarGC98,671179,Filtering with Approximate Predicates,Filtering with Approximate Predicates,1.0
278,744081,conf/vldb/Orenstein98,671178,Starting (and Sometimes Ending) a Database Company,Starting (and Sometimes Ending) a Database Company,1.0
279,744811,conf/vldb/Schoning98,671181,The ADABAS Buffer Pool Manager,The ADABAS Buffer Pool Manager,1.0
280,745357,conf/vldb/RoussopoulosK98,671180,The Cubetree Storage Organization,The Cubetree Storage Organization,1.0
281,745738,conf/vldb/BaulierBGJGKKMMNNRSS98,671175,DataBlitz: A High Performance Main-Memory Storage Manager,DataBlitz: A High Performance Main-Memory Storage Manager,1.0
282,747190,conf/vldb/Moerkotte98,671173,Small Materialized Aggregates: A Light Weight Index Structure for Data Warehousing,Small Materialized Aggregates: A Light Weight Index Structure for Data Warehousing,1.0
283,747833,conf/vldb/CherniackZ98,671177,Inferring Function Semantics to Optimize Queries,Inferring Function Semantics to Optimize Queries,1.0
284,748385,conf/vldb/Mihalisin98,671176,A Single Pass Computing Engine for Interactive Analysis of VLDBs,A Single Pass Computing Engine for Interactive Analysis of VLDBs,1.0
285,750235,conf/vldb/RamaswamyMS98,671170,On the Discovery of Interesting Patterns in Association Rules,On the Discovery of Interesting Patterns in Association Rules,1.0
286,750910,conf/vldb/Shaw98,671169,Technology and the Future of Commerce and Finance (Abstract),Technology and the Future of Commerce and Finance (Abstract),1.0
287,752566,conf/vldb/AbiteboulMRVW98,671172,Incremental Maintenance for Materialized Views over Semistructured Data,Incremental Maintenance for Materialized Views over Semistructured Data,1.0
288,752603,conf/vldb/BonczRK98,671171,The Drill Down Benchmark,The Drill Down Benchmark,1.0
289,753013,conf/vldb/CareyK98,671166,Reducing the Braking Distance of an SQL Query Engine,Reducing the Braking Distance of an SQL Query Engine,1.0
290,754456,conf/vldb/DoDJJR98,671165,Issues in Developing Very Large Data Warehouses,Issues in Developing Very Large Data Warehouses,1.0
291,755427,conf/vldb/FlorescuLS98,671168,Is Web-site Management a Database Problem?,Is Web-site Management a Database Problem?,1.0
292,755834,conf/vldb/BaulierBKS98,671167,A Database System for Real-Time Event Aggregation in Telecommunication,A Database System for Real-Time Event Aggregation in Telecommunication,1.0
293,757564,conf/vldb/ZimbraoS98,671196,A Raster Approximation For Processing of Spatial Joins,A Raster Approximation For Processing of Spatial Joins,1.0
294,757922,conf/vldb/HelmerWM98,671197,Diag-Join: An Opportunistic Join Algorithm for 1:N Relationships,Diag-Join: An Opportunistic Join Algorithm for 1:N Relationships,1.0
295,758758,conf/vldb/RezendeH98,671194,The Heterogeneity Problem and Middleware Technology: Experiences with and Performance of Database Gateways,The Heterogeneity Problem and Middleware Technology: Experiences with and Performance of Database Gateways,1.0
296,759362,conf/vldb/RezendeS98,671195,Bridging Heterogeneity: Research and Practice of Database Middleware Technology,Bridging Heterogeneity: Research and Practice of Database Middleware Technology,1.0
297,759952,conf/vldb/WeberSB98,671192,A Quantitative Analysis and Performance Study for Similarity-Search Methods in High-Dimensional Spaces,A Quantitative Analysis and Performance Study for Similarity-Search Methods in High-Dimensional Spaces,1.0
298,760725,conf/vldb/GarofalakisIO98,671193,Resource Scheduling for Composite Multimedia Objects,Resource Scheduling for Composite Multimedia Objects,1.0
299,761187,journals/vldb/GeorgeH00,671190,Secure Bufering in Firm Real-Time Database Systems,Secure Buffering in Firm Real-Time Database Systems,0.86
300,761670,conf/vldb/GeorgeH98,671190,Secure Buffering in Firm Real-Time Database Systems,Secure Buffering in Firm Real-Time Database Systems,1.0
301,762810,conf/vldb/JagadishKMPSS98,671191,Optimal Histograms with Quality Guarantees,Optimal Histograms with Quality Guarantees,1.0
302,763048,conf/vldb/GarciaLL98,671188,On Optimal Node Splitting for R-trees,On Optimal Node Splitting for R-trees,1.0
303,764050,conf/vldb/ShuklaDN98,671189,Materialized View Selection for Multidimensional Datasets,Materialized View Selection for Multidimensional Datasets,1.0
304,764949,conf/vldb/MorimotoFMTY98,671186,Algorithms for Mining Association Rules for Binary Segmentations of Huge Categorical Databases,Algorithms for Mining Association Rules for Binary Segmentations of Huge Categorical Databases,1.0
305,765448,conf/vldb/SchieferKBLF98,671187,IBM's DB2 Universal Database demonstrations at VLDB'98,IBM's DB2 Universal Database demonstrations at VLDB'98,1.0
306,766249,conf/vldb/JoshiBLL98,671184,Checkpointing in Oracle,Checkpointing in Oracle,1.0
307,767211,conf/vldb/MengLYWCR98,671185,Determining Text Databases to Search in the Internet,Determining Text Databases to Search in the Internet,1.0
308,767818,conf/vldb/ZouS98,671182,Safely and Efficiently Updating References During On-line Reorganization,Safely and Efficiently Updating References During On-line Reorganization,1.0
309,768618,conf/vldb/RastogiS98,671183,PUBLIC: A Decision Tree Classifier that Integrates Building and Pruning,PUBLIC: A Decision Tree Classifier that Integrates Building and Pruning,1.0
310,769785,conf/vldb/ZhangL98,671332,Buffering and Read-Ahead Strategies for External Mergesort,Buffering and Read-Ahead Strategies for External Mergesort,1.0
311,771436,conf/vldb/IshikawaSF98,671331,MindReader: Querying Databases Through Multiple Examples,MindReader: Querying Databases Through Multiple Examples,1.0
312,771971,conf/vldb/GehrkeRG98,671330,RainForest - A Framework for Fast Decision Tree Construction of Large Datasets,RainForest - A Framework for Fast Decision Tree Construction of Large Datasets,1.0
313,773254,conf/vldb/Ganguly98,671329,Design and Analysis of Parametric Query Optimization Algorithms,Design and Analysis of Parametric Query Optimization Algorithms,1.0
314,773567,conf/vldb/ChakrabartiSD98,671328,Mining Surprising Patterns Using Temporal Description Length,Mining Surprising Patterns Using Temporal Description Length,1.0
315,775384,conf/vldb/JohnsonM98,671327,Performance Measurements of Tertiary Storage Devices,Performance Measurements of Tertiary Storage Devices,1.0
316,775815,conf/vldb/MiloZ98,671326,Using Schema Matching to Simplify Heterogeneous Data Translation,Using Schema Matching to Simplify Heterogeneous Data Translation,1.0
317,777263,conf/vldb/DarEGP98,671325,DTL's DataSpot: Database Exploration Using Plain Language,DTL's DataSpot: Database Exploration Using Plain Language,1.0
318,778017,conf/vldb/Amer-YahiaCD98,671324,Bulk-Loading Techniques for Object Databases and an Application to Relational Data,Bulk-Loading Techniques for Object Databases and an Application to Relational Data,1.0
319,779131,conf/vldb/GrovlenHT98,671204,Low-Cost Compensation-Based Query Processing,Low-Cost Compensation-Based Query Processing,1.0
320,779457,conf/vldb/Sterling98,671203,The National Medical Knowledge Bank,The National Medical Knowledge Bank,1.0
321,780536,conf/vldb/GibsonKR98,671202,Clustering Categorical Data: An Approach Based on Dynamical Systems,Clustering Categorical Data: An Approach Based on Dynamical Systems,1.0
322,780584,journals/vldb/GibsonKR00,671202,Clustering Categorical Data: An Approach Based on Dynamical Systems,Clustering Categorical Data: An Approach Based on Dynamical Systems,1.0
323,781143,conf/vldb/EsterKSWX98,671201,Incremental Clustering for Mining in a Data Warehousing Environment,Incremental Clustering for Mining in a Data Warehousing Environment,1.0
324,782457,conf/vldb/LakshmiZ98,671200,Selectivity Estimation in Extensible Databases - A Neural Network Approach,Selectivity Estimation in Extensible Databases - A Neural Network Approach,1.0
325,783044,conf/vldb/Slutz98,671199,Massive Stochastic Testing of SQL,Massive Stochastic Testing of SQL,1.0
326,783740,conf/vldb/AnkerstBKS98,671198,Improving Adaptable Similarity Query Processing by Using Approximations,Improving Adaptable Similarity Query Processing by Using Approximations,1.0
327,785345,conf/vldb/Cuppens96,673637,Querying a Multilevel Database: A Logical Analysis,Querying a Multilevel Database: A Logical Analysis,1.0
328,785697,conf/vldb/PoosalaI97,673638,Selectivity Estimation Without the Attribute Value Independence Assumption,Selectivity Estimation Without the Attribute Value Independence Assumption,1.0
329,786704,conf/vldb/GyssensL97,673639,A Foundation for Multi-dimensional Databases,A Foundation for Multi-dimensional Databases,1.0
330,787444,conf/vldb/SkubiszewskiV97,673640,Concurrent Garbage Collection in O2,Concurrent Garbage Collection in O2,1.0
331,787829,conf/vldb/FaloutsosJS97,673641,Recovering Information from Summary Data,Recovering Information from Summary Data,1.0
332,789238,conf/vldb/MalonM97,673642,Critical Database Technologies for High Energy Physics,Critical Database Technologies for High Energy Physics,1.0
333,789976,conf/vldb/NgC97,673643,Integrating Reliable Memory in Databases,Integrating Reliable Memory in Databases,1.0
334,790132,journals/vldb/NgC98,673643,Integrating Reliable Memory in Databases,Integrating Reliable Memory in Databases,1.0
335,791019,conf/vldb/Huyn97,673644,Multiple-View Self-Maintenance in Data Warehousing Environments,Multiple-View Self-Maintenance in Data Warehousing Environments,1.0
336,791303,conf/vldb/AshwinRSSS97,673645,Garbage Collection in Object Oriented Databases Using Transactional Cyclic Reference Counting,Garbage Collection in Object Oriented Databases Using Transactional Cyclic Reference Counting,1.0
337,791393,journals/vldb/RoySSSA98,673645,Garbage Collection in Object-Oriented Databases Using Transactional Cyclic Reference Counting,Garbage Collection in Object Oriented Databases Using Transactional Cyclic Reference Counting,0.8924731182795699
338,792087,conf/vldb/ChaudhuriN97,673646,An Efficient Cost-Driven Index Selection Tool for Microsoft SQL Server,An Efficient Cost-Driven Index Selection Tool for Microsoft SQL Server,1.0
339,793819,conf/vldb/Jamil97,673648,Implementing Abstract Objects with Inheritance in Datalogneg,Implementing Abstract Objects with Inheritance in Datalogneg,1.0
340,794093,conf/vldb/ClaussenKMP97,673649,Optimizing Queries with Universal Quantification in Object-Oriented and Object-Relational Databases,Optimizing Queries with Universal Quantification in Object-Oriented and Object-Relational Databases,1.0
341,794501,conf/vldb/AlsabtiRS97,673650,A One-Pass Algorithm for Accurately Estimating Quantiles for Disk-Resident Data,A One-Pass Algorithm for Accurately Estimating Quantiles for Disk-Resident Data,1.0
342,795393,conf/vldb/MorimotoIM97,673651,Efficient Construction of Regression Trees with Range and Region Splitting,Efficient Construction of Regression Trees with Range and Region Splitting,1.0
343,796392,conf/vldb/BaumannFRW97,673652,Geo/Environmental and Medical Data Management in the RasDaMan System,Geo/Environmental and Medical Data Management in the RasDaMan System,1.0
344,797604,conf/vldb/StathatosRB97,673653,Adaptive Data Broadcast in Hybrid Networks,Adaptive Data Broadcast in Hybrid Networks,1.0
345,797922,conf/vldb/CochranePM96,673498,Integrating Triggers and Declarative Constraints in SQL Database Sytems,Integrating Triggers and Declarative Constraints in SQL Database Sytems,1.0
346,799887,conf/vldb/AgarwalADGNRS96,673497,On the Computation of Multidimensional Aggregates,On the Computation of Multidimensional Aggregates,1.0
347,800368,conf/vldb/MeoPC96,673500,A New SQL-like Operator for Mining Association Rules,A New SQL-like Operator for Mining Association Rules,1.0
348,801249,conf/vldb/Rengarajan96,673499,How System 11 SQL Server Became Fast,How System 11 SQL Server Became Fast,1.0
349,801675,conf/vldb/BerchtoldKK96,673502,The X-tree : An Index Structure for High-Dimensional Data,The X-tree: An Index Structure for High-Dimensional Data,0.8421052631578947
350,802779,conf/vldb/RysNS96,673501,Intra-Transaction Parallelism in the Mapping of an Object Model to a Relational Multi-Processor System,Intra-Transaction Parallelism in the Mapping of an Object Model to a Relational Multi-Processor System,1.0
351,803165,conf/vldb/ChatziantoniouR96,673628,Querying Multiple Features of Groups in Relational Databases,Querying Multiple Features of Groups in Relational Databases,1.0
352,804629,conf/vldb/SrivastavaDJL96,673627,Answering Queries with Aggregation Using Views,Answering Queries with Aggregation Using Views,1.0
353,805580,conf/vldb/Malaika96,673630,Database Management Systems and the Internet,Database Management Systems and the Internet,1.0
354,806371,conf/vldb/Suciu96,673629,Query Decomposition and View Maintenance for Query Languages for Unstructured Data,Query Decomposition and View Maintenance for Query Languages for Unstructured Data,1.0
355,807053,conf/vldb/SarawagiS96,673632,Reordering Query Execution in Tertiary Memory Databases,Reordering Query Execution in Tertiary Memory Databases,1.0
356,807834,conf/vldb/Mohan96,673631,DWMS: Data Warehouse Management System,DWMS: Data Warehouse Management System,1.0
357,808535,conf/vldb/SeshadriLR96,673634,The Design and Implementation of a Sequence Database System,The Design and Implementation of a Sequence Database System,1.0
358,810162,conf/vldb/CareyHMW96,673633,PESTO : An Integrated Query/Browser for Object Databases,PESTO: An Integrated Query/Browser for Object Databases,0.8392857142857143
359,810618,conf/vldb/DiwanRSS96,673636,Clustering Techniques for Minimizing External Path Length,Clustering Techniques for Minimizing External Path Length,1.0
360,811822,conf/vldb/VermeerA96,673635,The Role of Integrity Constraints in Database Interoperation,The Role of Integrity Constraints in Database Interoperation,1.0
361,812873,conf/vldb/RamakrishnanGRSWZ95,756661,Scientific Journals: Extinction or Explosion? (Panel),Scientific Journals: Extinction or Explosion? (Panel),1.0
362,814308,conf/vldb/PatonG01,757416,Information Management for Genome Level Bioinformatics,Information Management for Genome Level Bioinformatics,1.0
363,814836,conf/vldb/DeutschPT99,756643,"Physical Data Independence, Constraints, and Optimization with Universal Plans","Physical Data Independence, Constraints, and Optimization with Universal Plans",1.0
364,815966,conf/vldb/GuPS00,756647,OLAP++: Powerful and Easy-to-Use Federations of OLAP and Object Databases,OLAP++: Powerful and Easy-to-Use Federations of OLAP and Object Databases,1.0
365,817169,conf/vldb/LuSL95,758364,NeuroRule: A Connectionist Approach to Data Mining,NeuroRule: A Connectionist Approach to Data Mining,1.0
366,817778,conf/vldb/Korth95,758365,The Double Life of the Transaction Abstraction: Fundamental Principle and Evolving System Concept,The Double Life of the Transaction Abstraction: Fundamental Principle and Evolving System Concept,1.0
367,818452,conf/vldb/Leymann01,757417,Managing Business Processes via Workflow Technology,Managing Business Processes via Workflow Technology,1.0
368,819828,conf/vldb/ShatdalKN94,758363,Cache Conscious Algorithms for Relational Query Processing,Cache Conscious Algorithms for Relational Query Processing,1.0
369,820202,conf/vldb/GarofalakisOS97,758368,Resource Scheduling in Enhanced Pay-Per-View Continuous Media Databases,Resource Scheduling in Enhanced Pay-Per-View Continuous Media Databases,1.0
370,821482,conf/vldb/WangYM97,758369,STING: A Statistical Information Grid Approach to Spatial Data Mining,STING: A Statistical Information Grid Approach to Spatial Data Mining,1.0
371,823226,conf/vldb/Baru96,758366,Performance of Future Database Systems: Bottlenecks and Bonananzas,Performance of Future Database Systems: Bottlenecks and Bonananzas,1.0
372,824314,conf/vldb/ScheuermannSV96,758367,WATCHMAN : A Data Warehouse Intelligent Cache Manager,WATCHMAN: A Data Warehouse Intelligent Cache Manager,0.8301886792452831
373,824482,conf/vldb/KoudasMJ99,758373,Mining Deviants in a Time Series Database,Mining Deviants in a Time Series Database,1.0
374,825155,conf/vldb/ZirintsisKM99,758374,Hyper-Programming in Java,Hyper-Programming in Java,1.0
375,825529,conf/vldb/ArunJ98,758370,KODA - The Architecture And Interface of a Data Model Independent Kernel,KODA - The Architecture And Interface of a Data Model Independent Kernel,1.0
376,826501,conf/vldb/FankhauserGLMT98,758371,Experiences in Federated Databases: From IRO-DB to MIRO-Web,Experiences in Federated Databases: From IRO-DB to MIRO-Web,1.0
377,827837,conf/vldb/YangKL97,673657,Algorithms for Materialized View Design in Data Warehousing Environment,Algorithms for Materialized View Design in Data Warehousing Environment,1.0
378,828385,conf/vldb/TheodoratosS97,673656,Data Warehouse Configuration,Data Warehouse Configuration,1.0
379,829203,conf/vldb/SeidlK97,673655,Efficient User-Adaptable Similarity Search in Large Multimedia Databases,Efficient User-Adaptable Similarity Search in Large Multimedia Databases,1.0
380,829962,conf/vldb/FlorescuKLP97,673654,Using Probabilistic Information in Data Integration,Using Probabilistic Information in Data Integration,1.0
381,831070,conf/vldb/PellenkoftLK97,673661,The Complexity of Transformation-Based Join Enumeration,The Complexity of Transformation-Based Join Enumeration,1.0
382,832244,conf/vldb/WhiteheadSM97,673660,GTE SuperPages: Using IR Techniques for Searching Complex Objects,GTE SuperPages: Using IR Techniques for Searching Complex Objects,1.0
383,832997,conf/vldb/ChakrabartiDAR97,673659,"Using Taxonomy, Discriminants, and Signatures for Navigating in Text Databases","Using Taxonomy, Discriminants, and Signatures for Navigating in Text Databases",1.0
384,834541,conf/vldb/SellisRF97,673658,Multidimensional Access Methods: Trees Have Grown Everywhere,Multidimensional Access Methods: Trees Have Grown Everywhere,1.0
385,835048,conf/vldb/LockemannKKKN97,673665,"The Network as a Global Database: Challenges of Interoperability, Proactivity, Interactiveness, Legacy","The Network as a Global Database: Challenges of Interoperability, Proactivity, Interactiveness, Legacy",1.0
386,835342,conf/vldb/KraissW97,673664,Vertical Data Migration in Large Near-Line Document Archives Based on Markov-Chain Predictions,Vertical Data Migration in Large Near-Line Document Archives Based on Markov-Chain Predictions,1.0
387,836278,conf/vldb/TriantafillouP97,673663,On-Demand Data Elevation in Hierarchical Multimedia Storage Servers,On-Demand Data Elevation in Hierarchical Multimedia Storage Servers,1.0
388,836879,conf/vldb/VassalosP97,673662,Describing and Using Query Capabilities of Heterogeneous Sources,Describing and Using Query Capabilities of Heterogeneous Sources,1.0
389,838558,conf/vldb/GibbonsMP97,673669,Fast Incremental Maintenance of Approximate Histograms,Fast Incremental Maintenance of Approximate Histograms,1.0
390,838949,conf/vldb/LiCHH97,673668,Facilitating Multimedia Database Exploration through Visual Interfaces and Perpetual Query Reformulations,Facilitating Multimedia Database Exploration through Visual Interfaces and Perpetual Query Reformulations,1.0
391,839512,conf/vldb/HelmerM97,673667,Evaluation of Main Memory Join Algorithms for Joins with Set Comparison Join Predicates,Evaluation of Main Memory Join Algorithms for Joins with Set Comparison Join Predicates,1.0
392,839738,conf/vldb/EicklerKK97,673666,Finding Data in the Neighborhood,Finding Data in the Neighborhood,1.0
393,840765,conf/vldb/Toivonen96,673325,Sampling Large Databases for Association Rules,Sampling Large Databases for Association Rules,1.0
394,841391,conf/vldb/Dyreson96,673326,Information Retrieval from an Incomplete Data Cube,Information Retrieval from an Incomplete Data Cube,1.0
395,843064,conf/vldb/FaloutsosMS96,673328,Modeling Skewed Distribution Using Multifractals and the `80-20' Law,Modeling Skewed Distribution Using Multifractals and the `80-20' Law,1.0
396,843149,conf/vldb/Padmanabhan96,673329,Extracting Large Data Sets using DB2 Parallel Edition,Extracting Large Data Sets using DB2 Parallel Edition,1.0
397,844840,conf/vldb/Ogawa96,673320,Effective & Efficient Document Ranking without using a Large Lexicon,Effective &; Efficient Document Ranking without using a Large Lexicon,0.8695652173913043
