,_id,l_id,r_id,l_title,r_title,_sim_score
417,855307,conf/vldb/AgarwalADGNRS96,673497,On the Computation of Multidimensional Aggregates,On the Computation of Multidimensional Aggregates,1.0
418,855659,conf/vldb/MeoPC96,673500,A New SQL-like Operator for Mining Association Rules,A New SQL-like Operator for Mining Association Rules,1.0
419,856318,conf/vldb/Rengarajan96,673499,How System 11 SQL Server Became Fast,How System 11 SQL Server Became Fast,1.0
420,856636,conf/vldb/BerchtoldKK96,673502,The X-tree : An Index Structure for High-Dimensional Data,The X-tree: An Index Structure for High-Dimensional Data,0.9622641509433962
421,856729,journals/vldb/LinJF94,673502,The TV-Tree: An Index Structure for High-Dimensional Data,The X-tree: An Index Structure for High-Dimensional Data,0.8596491228070176
422,858264,conf/vldb/RysNS96,673501,Intra-Transaction Parallelism in the Mapping of an Object Model to a Relational Multi-Processor System,Intra-Transaction Parallelism in the Mapping of an Object Model to a Relational Multi-Processor System,1.0
423,859265,conf/vldb/ChatziantoniouR96,673628,Querying Multiple Features of Groups in Relational Databases,Querying Multiple Features of Groups in Relational Databases,1.0
424,860399,conf/vldb/SrivastavaDJL96,673627,Answering Queries with Aggregation Using Views,Answering Queries with Aggregation Using Views,1.0
425,861019,conf/vldb/Malaika96,673630,Database Management Systems and the Internet,Database Management Systems and the Internet,1.0
426,861921,conf/vldb/Suciu96,673629,Query Decomposition and View Maintenance for Query Languages for Unstructured Data,Query Decomposition and View Maintenance for Query Languages for Unstructured Data,1.0
427,863002,conf/vldb/SarawagiS96,673632,Reordering Query Execution in Tertiary Memory Databases,Reordering Query Execution in Tertiary Memory Databases,1.0
428,863833,conf/vldb/Mohan96,673631,DWMS: Data Warehouse Management System,DWMS: Data Warehouse Management System,1.0
429,864453,conf/vldb/SeshadriLR96,673634,The Design and Implementation of a Sequence Database System,The Design and Implementation of a Sequence Database System,1.0
430,865534,conf/vldb/CareyHMW96,673633,PESTO : An Integrated Query/Browser for Object Databases,PESTO: An Integrated Query/Browser for Object Databases,0.9411764705882353
431,865904,conf/vldb/DiwanRSS96,673636,Clustering Techniques for Minimizing External Path Length,Clustering Techniques for Minimizing External Path Length,1.0
432,866952,conf/vldb/VermeerA96,673635,The Role of Integrity Constraints in Database Interoperation,The Role of Integrity Constraints in Database Interoperation,1.0
433,867799,conf/vldb/RamakrishnanGRSWZ95,756661,Scientific Journals: Extinction or Explosion? (Panel),Scientific Journals: Extinction or Explosion? (Panel),1.0
434,868918,conf/vldb/PatonG01,757416,Information Management for Genome Level Bioinformatics,Information Management for Genome Level Bioinformatics,1.0
435,869443,conf/vldb/DeutschPT99,756643,"Physical Data Independence, Constraints, and Optimization with Universal Plans","Physical Data Independence, Constraints, and Optimization with Universal Plans",1.0
436,870716,conf/vldb/GuPS00,756647,OLAP++: Powerful and Easy-to-Use Federations of OLAP and Object Databases,OLAP++: Powerful and Easy-to-Use Federations of OLAP and Object Databases,1.0
437,871509,conf/vldb/LuSL95,758364,NeuroRule: A Connectionist Approach to Data Mining,NeuroRule: A Connectionist Approach to Data Mining,1.0
438,872278,conf/vldb/Korth95,758365,The Double Life of the Transaction Abstraction: Fundamental Principle and Evolving System Concept,The Double Life of the Transaction Abstraction: Fundamental Principle and Evolving System Concept,1.0
439,873615,conf/vldb/Leymann01,757417,Managing Business Processes via Workflow Technology,Managing Business Processes via Workflow Technology,1.0
440,874724,conf/vldb/ShatdalKN94,758363,Cache Conscious Algorithms for Relational Query Processing,Cache Conscious Algorithms for Relational Query Processing,1.0
441,875082,conf/vldb/GarofalakisOS97,758368,Resource Scheduling in Enhanced Pay-Per-View Continuous Media Databases,Resource Scheduling in Enhanced Pay-Per-View Continuous Media Databases,1.0
442,876452,conf/vldb/WangYM97,758369,STING: A Statistical Information Grid Approach to Spatial Data Mining,STING: A Statistical Information Grid Approach to Spatial Data Mining,1.0
443,878182,conf/vldb/Baru96,758366,Performance of Future Database Systems: Bottlenecks and Bonananzas,Performance of Future Database Systems: Bottlenecks and Bonananzas,1.0
444,878847,conf/vldb/ScheuermannSV96,758367,WATCHMAN : A Data Warehouse Intelligent Cache Manager,WATCHMAN: A Data Warehouse Intelligent Cache Manager,0.94
445,879026,conf/vldb/KoudasMJ99,758373,Mining Deviants in a Time Series Database,Mining Deviants in a Time Series Database,1.0
446,879759,conf/vldb/ZirintsisKM99,758374,Hyper-Programming in Java,Hyper-Programming in Java,1.0
447,880140,conf/vldb/ArunJ98,758370,KODA - The Architecture And Interface of a Data Model Independent Kernel,KODA - The Architecture And Interface of a Data Model Independent Kernel,1.0
448,881048,conf/vldb/FankhauserGLMT98,758371,Experiences in Federated Databases: From IRO-DB to MIRO-Web,Experiences in Federated Databases: From IRO-DB to MIRO-Web,1.0
449,882097,conf/vldb/YangKL97,673657,Algorithms for Materialized View Design in Data Warehousing Environment,Algorithms for Materialized View Design in Data Warehousing Environment,1.0
450,882628,conf/vldb/TheodoratosS97,673656,Data Warehouse Configuration,Data Warehouse Configuration,1.0
451,883993,conf/vldb/SeidlK97,673655,Efficient User-Adaptable Similarity Search in Large Multimedia Databases,Efficient User-Adaptable Similarity Search in Large Multimedia Databases,1.0
452,884770,conf/vldb/FlorescuKLP97,673654,Using Probabilistic Information in Data Integration,Using Probabilistic Information in Data Integration,1.0
453,885733,conf/vldb/PellenkoftLK97,673661,The Complexity of Transformation-Based Join Enumeration,The Complexity of Transformation-Based Join Enumeration,1.0
454,886709,conf/vldb/WhiteheadSM97,673660,GTE SuperPages: Using IR Techniques for Searching Complex Objects,GTE SuperPages: Using IR Techniques for Searching Complex Objects,1.0
455,887376,conf/vldb/ChakrabartiDAR97,673659,"Using Taxonomy, Discriminants, and Signatures for Navigating in Text Databases","Using Taxonomy, Discriminants, and Signatures for Navigating in Text Databases",1.0
456,888959,conf/vldb/SellisRF97,673658,Multidimensional Access Methods: Trees Have Grown Everywhere,Multidimensional Access Methods: Trees Have Grown Everywhere,1.0
457,890284,conf/vldb/LockemannKKKN97,673665,"The Network as a Global Database: Challenges of Interoperability, Proactivity, Interactiveness, Legacy","The Network as a Global Database: Challenges of Interoperability, Proactivity, Interactiveness, Legacy",1.0
458,890933,conf/vldb/KraissW97,673664,Vertical Data Migration in Large Near-Line Document Archives Based on Markov-Chain Predictions,Vertical Data Migration in Large Near-Line Document Archives Based on Markov-Chain Predictions,1.0
459,892271,conf/vldb/TriantafillouP97,673663,On-Demand Data Elevation in Hierarchical Multimedia Storage Servers,On-Demand Data Elevation in Hierarchical Multimedia Storage Servers,1.0
460,894024,conf/vldb/VassalosP97,673662,Describing and Using Query Capabilities of Heterogeneous Sources,Describing and Using Query Capabilities of Heterogeneous Sources,1.0
461,894442,journals/tods/GibbonsMP02,673669,Fast incremental maintenance of approximate histograms,Fast Incremental Maintenance of Approximate Histograms,0.7358490566037735
462,894944,conf/vldb/GibbonsMP97,673669,Fast Incremental Maintenance of Approximate Histograms,Fast Incremental Maintenance of Approximate Histograms,1.0
463,895629,conf/vldb/LiCHH97,673668,Facilitating Multimedia Database Exploration through Visual Interfaces and Perpetual Query Reformulations,Facilitating Multimedia Database Exploration through Visual Interfaces and Perpetual Query Reformulations,1.0
464,897209,conf/vldb/HelmerM97,673667,Evaluation of Main Memory Join Algorithms for Joins with Set Comparison Join Predicates,Evaluation of Main Memory Join Algorithms for Joins with Set Comparison Join Predicates,1.0
465,897861,conf/vldb/EicklerKK97,673666,Finding Data in the Neighborhood,Finding Data in the Neighborhood,1.0
466,899055,conf/vldb/Toivonen96,673325,Sampling Large Databases for Association Rules,Sampling Large Databases for Association Rules,1.0
467,899632,conf/vldb/Dyreson96,673326,Information Retrieval from an Incomplete Data Cube,Information Retrieval from an Incomplete Data Cube,1.0
468,900818,conf/vldb/FaloutsosMS96,673328,Modeling Skewed Distribution Using Multifractals and the `80-20' Law,Modeling Skewed Distribution Using Multifractals and the `80-20' Law,1.0
469,900900,conf/vldb/Padmanabhan96,673329,Extracting Large Data Sets using DB2 Parallel Edition,Extracting Large Data Sets using DB2 Parallel Edition,1.0
470,902328,conf/vldb/Ogawa96,673320,Effective & Efficient Document Ranking without using a Large Lexicon,Effective &; Efficient Document Ranking without using a Large Lexicon,0.9473684210526315
471,902651,conf/vldb/PoosalaI96,673321,Estimation of Query-Result Distribution and its Application in Parallel-Join Load Balancing,Estimation of Query-Result Distribution and its Application in Parallel-Join Load Balancing,1.0
472,904251,conf/vldb/AcharyaFZ96,673323,Disseminating Updates on Broadcast Disks,Disseminating Updates on Broadcast Disks,1.0
473,905489,conf/vldb/Gupta96,673324,The Changing Landscape of the Software Industry and its Implications for India,The Changing Landscape of the Software Industry and its Implications for India,1.0
474,905915,conf/vldb/Gawlick96,673334,Scalablity and Availability in Oracle7 7.3,Scalablity and Availability in Oracle7 7.3,1.0
475,906933,journals/tods/ChaudhuriS99,673461,Optimization of Queries with User-Defined Predicates,Optimization of Queries with User-defined Predicates,0.9166666666666666
476,907122,conf/vldb/ChaudhuriS96,673461,Optimization of Queries with User-defined Predicates,Optimization of Queries with User-defined Predicates,1.0
477,907647,conf/vldb/DarFJST96,673462,Semantic Data Caching and Replacement,Semantic Data Caching and Replacement,1.0
478,908011,conf/vldb/Raghavan96,673463,Loading the Data Warehouse Across Various Parallel Architectures,Loading the Data Warehouse Across Various Parallel Architectures,1.0
479,909366,conf/vldb/BouganimFV96,673330,Dynamic Load Balancing in Hierarchical Parallel Database Systems,Dynamic Load Balancing in Hierarchical Parallel Database Systems,1.0
480,909862,conf/vldb/RahmM95,673330,Dynamic Multi-Resource Load Balancing in Parallel Database Systems,Dynamic Load Balancing in Hierarchical Parallel Database Systems,0.7101449275362319
481,911444,conf/vldb/LeeL96,673331,Further Improvements on Integrity Constraint Checking for Stratifiable Deductive Databases,Further Improvements on Integrity Constraint Checking for Stratifiable Deductive Databases,1.0
482,912172,conf/vldb/Levy96,673332,Obtaining Complete Answers from Incomplete Databases,Obtaining Complete Answers from Incomplete Databases,1.0
483,912827,conf/vldb/RamakrishnanR96,673333,Modeling Design Versions,Modeling Design Versions,1.0
484,913730,conf/vldb/CabreraRH95,673308,Applying Database Technology in the ADSM Mass Storage System,Applying Database Technology in the ADSM Mass Storage System,1.0
485,914912,conf/vldb/MogiK95,673307,Hot Block Clustering for Disk Arrays with Dynamic Striping,Hot Block Clustering for Disk Arrays with Dynamic Striping,1.0
486,915261,conf/vldb/FlodinR95,673311,Processing Object-Oriented Queries with Invertible Late Bound Functions,Processing Object-Oriented Queries with Invertible Late Bound Functions,1.0
487,916774,conf/vldb/TreschPL95,673309,Type Classification of Semi-Structured Documents,Type Classification of Semi-Structured Documents,1.0
488,917260,conf/vldb/SrikantA95,673304,Mining Generalized Association Rules,Mining Generalized Association Rules,1.0
489,918242,conf/vldb/SeligmanBNSW95,673303,Metrics for Accessing Heterogeneous Data: Is There Any Hope? (Panel),Metrics for Accessing Heterogeneous Data: Is There Any Hope? (Panel),1.0
490,919632,conf/vldb/Madnick95,673306,From VLDB to VMLDB (Very MANY Large Data Bases): Dealing with Large-Scale Semantic Heterogenity,From VLDB to VMLDB (Very MANY Large Data Bases): Dealing with Large-Scale Semantic Heterogenity,1.0
491,920037,conf/vldb/KornackerB95,673305,High-Concurrency Locking in R-Trees,High-Concurrency Locking in R-Trees,1.0
492,920833,conf/vldb/LeslieJBY95,673317,Efficient Search of Multi-Dimensional B-Trees,Efficient Search of Multi-Dimensional B-Trees,1.0
493,921457,conf/vldb/EvangelidisLS95,673316,"The hBP-tree: A Modified hB-tree Supporting Concurrency, Recovery and Node Consolidation","The hBP-tree: A Modified hB-tree Supporting Concurrency, Recovery and Node Consolidation",1.0
494,922298,conf/vldb/SimonD95,673319,Promises and Realities of Active Database Systems,Promises and Realities of Active Database Systems,1.0
495,923047,conf/vldb/ReuterCGSW95,673318,Databases and Workflow Management: What is it All About? (Panel),Databases and Workflow Management: What is it All About? (Panel),1.0
496,923831,conf/vldb/DidriksenGD95,673313,Database De-Centralization - A Practical Approach,Database De-Centralization - A Practical Approach,1.0
497,925350,conf/vldb/ChaudhuriGS95,673312,Retrieval of Composite Multimedia Objects,Retrieval of Composite Multimedia Objects,1.0
498,926265,conf/vldb/KalusD95,673315,Flexible Relations - Operational Support of Variant Relational Structures,Flexible Relations - Operational Support of Variant Relational Structures,1.0
499,927141,conf/vldb/FerrandinaMZFM95,673314,Schema and Database Evolution in the O2 Object Database System,Schema and Database Evolution in the O2 Object Database System,1.0
500,928048,conf/vldb/FaloutsosG96,673487,Analysis of n-Dimensional Quadtrees using the Hausdorff Fractal Dimension,Analysis of n-Dimensional Quadtrees using the Hausdorff Fractal Dimension,1.0
501,928616,conf/vldb/Suciu96a,673488,Implementation and Analysis of a Parallel Collection Query Language,Implementation and Analysis of a Parallel Collection Query Language,1.0
502,929706,conf/vldb/GardarinST96,673485,"Calibrating the Query Optimizer Cost Model of IRO-DB, an Object-Oriented Federated Database System","Calibrating the Query Optimizer Cost Model of IRO-DB, an Object-Oriented Federated Database System",1.0
503,931095,conf/vldb/Sacks-Davis96,673486,The Structured Information Manager: A Database System for SGML Documents,The Structured Information Manager: A Database System for SGML Documents,1.0
504,932049,conf/vldb/Klots96,673483,Cache Coherency in Oracle Parallel Server,Cache Coherency in Oracle Parallel Server,1.0
505,932516,conf/vldb/GardarinGT96,673484,Cost-based Selection of Path Expression Processing Algorithms in Object-Oriented Databases,Cost-based Selection of Path Expression Processing Algorithms in Object-Oriented Databases,1.0
506,933914,conf/vldb/PapakonstantinouAG96,673481,Object Fusion in Mediator Systems,Object Fusion in Mediator Systems,1.0
507,934453,conf/vldb/GuptaM96,673482,What is the Data Warehousing Problem? (Are Materialized Views the Answer?),What is the Data Warehousing Problem? (Are Materialized Views the Answer?),1.0
508,935303,conf/vldb/FukudaMMT96,673495,Constructing Efficient Decision Trees by Using Optimized Numeric Association Rules,Constructing Efficient Decision Trees by Using Optimized Numeric Association Rules,1.0
509,936592,conf/vldb/IoannidisLGP96,673496,ZOO : A Desktop Experiment Management Environment,ZOO: A Desktop Experiment Management Environment,0.926829268292683
510,936860,conf/sigmod/IoannidisLANT97,673496,ZOO: A Desktop Emperiment Management Environment,ZOO: A Desktop Experiment Management Environment,0.9024390243902439
511,937041,conf/vldb/KornSFSP96,673493,Fast Nearest Neighbor Search in Medical Image Databases,Fast Nearest Neighbor Search in Medical Image Databases,1.0
512,938394,conf/vldb/ShuklaDNR96,673494,Storage Estimation for Multidimensional Aggregates in the Presence of Hierarchies,Storage Estimation for Multidimensional Aggregates in the Presence of Hierarchies,1.0
513,938907,conf/vldb/ShaferAM96,673491,SPRINT: A Scalable Parallel Classifier for Data Mining,SPRINT: A Scalable Parallel Classifier for Data Mining,1.0
514,939795,conf/vldb/Sheth96,673492,Bellcore's ADAPT/X Harness System for Managing Information on Internet and Intranets,Bellcore's ADAPT/X Harness System for Managing Information on Internet and Intranets,1.0
515,941718,conf/vldb/Sullivan96,673489,Tribeca: A Stream Database Manager for Network Traffic Analysis,Tribeca: A Stream Database Manager for Network Traffic Analysis,1.0
516,942424,conf/vldb/LakshmananSS96,673490,SchemaSQL - A Language for Interoperability in Relational Multi-Database Systems,SchemaSQL - A Language for Interoperability in Relational Multi-Database Systems,1.0
517,944124,conf/vldb/Celis96,673471,The Query Optimizer in Tandem's new ServerWare SQL Product,The Query Optimizer in Tandem's new ServerWare SQL Product,1.0
518,944477,journals/sigmod/Bhashyam96,673470,"TCP-D - The Challenges, Issues and Results","TPC-D: The Challenges, Issues and Results",0.7441860465116279
519,944707,conf/vldb/Bhashyam96,673470,"TPC-D: The Challenges, Issues and Results","TPC-D: The Challenges, Issues and Results",1.0
520,945886,conf/vldb/LevyRO96,673469,Querying Heterogeneous Information Sources Using Source Descriptions,Querying Heterogeneous Information Sources Using Source Descriptions,1.0
521,946602,conf/vldb/ShethKMWDLPLS96,673468,Supporting State-Wide Immunisation Tracking Using Multi-Paradigm Workflow Technology,Supporting State-Wide Immunisation Tracking Using Multi-Paradigm Workflow Technology,1.0
522,947247,conf/vldb/Mattos96,673467,Supporting Procedural Constructs in SQL Compilers,Supporting Procedural Constructs in SQL Compilers,1.0
523,948953,conf/vldb/SevcikK96,673466,Filter Trees for Managing Spatial Data over a Range of Size Granularities,Filter Trees for Managing Spatial Data over a Range of Size Granularities,1.0
524,949635,conf/vldb/CareyD96,673465,Of Objects and Databases: A Decade of Turmoil,Of Objects and Databases: A Decade of Turmoil,1.0
525,951425,conf/vldb/ViverosNR96,673464,Applying Data Mining Techniques to a Health Insurance Information System,Applying Data Mining Techniques to a Health Insurance Information System,1.0
526,951632,conf/vldb/BerckenS96,673480,Query Processing Techniques for Multiversion Access Methods,Query Processing Techniques for Multiversion Access Methods,1.0
527,953240,conf/vldb/StaudtJ96,673479,Incremental Maintenance of Externally Materialized Views,Incremental Maintenance of Externally Materialized Views,1.0
528,954145,conf/vldb/MiningGroup96,673478,MineSet(tm): A System for High-End Data Mining and Visualization,MineSet(tm): A System for High-End Data Mining and Visualization,1.0
529,954653,conf/vldb/LabioG96,673477,Efficient Snapshot Differential Algorithms for Data Warehousing,Efficient Snapshot Differential Algorithms for Data Warehousing,1.0
530,955773,conf/vldb/McKennaBHT96,673476,EROC: A Toolkit for Building NEATO Query Optimizers,EROC: A Toolkit for Building NEATO Query Optimizers,1.0
531,955896,conf/vldb/BertinoBFS96,673475,Supporting Periodic Authorizations and Temporal Reasoning in Database Access Control,Supporting Periodic Authorizations and Temporal Reasoning in Database Access Control,1.0
0,957771,conf/vldb/BohlenSS96,673474,Coalescing in Temporal Databases,Coalescing in Temporal Databases,1.0
1,958598,conf/vldb/Kleewein96,673472,Practical Issues with Commercial Use of Federated Databases,Practical Issues with Commercial Use of Federated Databases,1.0
2,959487,journals/vldb/PanagosB97,765557,Synchronization and Recovery in a Client-Server Storage System,Synchronization and recovery in a client-server storage system,0.7377049180327869
3,960300,journals/vldb/SteinbrunnMK97,765556,Heuristic and Randomized Optimization for the Join Ordering Problem,Heuristic and randomized optimization for the join ordering problem,0.7301587301587301
4,961894,journals/vldb/LometS97,765558,Concurrency and Recovery for Index Trees,Concurrency and recovery for index trees,0.725
5,964759,journals/vldb/BohmAnY97,765564,Structured Document Storage and Refined Declarative and Navigational Access Mechanisms in HyperStorM,Structured document storage and refined declarative and navigational access mechanisms in HyperStorM,0.7613636363636364
6,967837,journals/vldb/CatarciSC97,765550,Graphical Interaction with Heterogeneous Databases,Graphical interaction with heterogeneous databases,0.7692307692307693
7,969306,journals/vldb/IoannidisNSS97,765552,Parametric Query Optimization,Parametric query optimization,0.7419354838709677
8,972734,journals/vldb/MehrotraKS97,765553,Concurrency Control in Hierarchical Multidatabase Systems,Concurrency control in hierarchical multidatabase systems,0.7627118644067796
9,975725,journals/vldb/SofferS98,765540,Integrating Symbolic Images into a Multimedia Database System Using Classification and Abstraction Approaches,Integrating symbolic images into a multimedia database system using classification and abstraction approaches,0.7204301075268817
10,977149,journals/vldb/ZezulaSAR98,765541,Approximate Similarity Retrieval with M-Trees,Approximate similarity retrieval with M-trees,0.7777777777777778
11,977804,journals/vldb/BalkirO98,765542,Delivering Presentations from Multimedia Servers,Delivering presentations from multimedia servers,0.7708333333333334
12,981531,journals/vldb/BernsteinIR03,765530,Guest editorial,Guest Editorial,0.75
13,981553,journals/vldb/AtluriJY03,765530,Guest editorial,Guest Editorial,0.75
14,981682,journals/vldb/AbbadiSW01,765530,Guest editorial,Guest Editorial,0.75
15,981697,journals/vldb/Halevy02,765530,Guest Editorial,Guest Editorial,1.0
16,981713,journals/vldb/Atkinson00,765530,Guest editorial,Guest Editorial,0.75
17,983903,journals/vldb/ChakrabartiDAR98,765533,"Scalable Feature Selection, Classification and Signature Generation for Organizing Large Text Databases into Hierarchical Topic Taxonomies","Scalable feature selection, classification and signature generation for organizing large text databases into hierarchical topic taxonomies",0.7027027027027027
18,986686,conf/vldb/NgC97,765535,Integrating Reliable Memory in Databases,Integrating reliable memory in databases,0.7142857142857143
19,986824,journals/vldb/NgC98,765535,Integrating Reliable Memory in Databases,Integrating reliable memory in databases,0.7142857142857143
20,987646,journals/vldb/HjaltasonS02,767129,Speeding up construction of PMR quadtree-based spatial indexes,Speeding up construction of PMR quadtree-based spatial indexes,1.0
21,988757,journals/vldb/SakuraiYUK02,767128,Spatial indexing of high-dimensional data based on relative approximation,Spatial indexing of high-dimensional data based on relative approximation,1.0
22,989198,journals/vldb/MaratheS02,767098,Query processing techniques for arrays,Query processing techniques for arrays,1.0
23,989235,conf/sigmod/MaratheS99,767098,Query Processing Techniques for Arrays,Query processing techniques for arrays,0.7073170731707317
24,989739,journals/vldb/FerrariAABC02,767097,An authorization system for digital libraries,An authorization system for digital libraries,1.0
25,991566,journals/vldb/MecellaP01,767134,Designing wrapper components for e-services in integrating heterogeneous systems,Designing wrapper components for e-services in integrating heterogeneous systems,1.0
26,991645,journals/vldb/BernsteinIR03,767133,Guest editorial,Guest editorial,1.0
27,991667,journals/vldb/AtluriJY03,767133,Guest editorial,Guest editorial,1.0
28,991781,journals/vldb/AbbadiSW01,767133,Guest editorial,Guest editorial,1.0
29,991793,journals/vldb/Halevy02,767133,Guest Editorial,Guest editorial,0.75
30,991809,journals/vldb/Atkinson00,767133,Guest editorial,Guest editorial,1.0
31,992358,journals/vldb/FengYLH02,767131,A template model for multidimensional inter-transactional association rules,A template model for multidimensional inter-transactional association rules,1.0
32,993446,journals/vldb/NanopoulosM02,767130,Efficient similarity search for market basket data,Efficient similarity search for market basket data,1.0
33,996858,journals/vldb/AntoshenkovZ96,765852,Query Processing and Optimization in Oracle Rdb,Query processing and optimization in Oracle Rdb,0.8478260869565217
34,997646,journals/vldb/MihailaRT02,767096,Locating and accessing data repositories with WebSemantics,Locating and accessing data repositories with WebSemantics,1.0
35,998346,journals/vldb/Navarro02,767095,Searching in metric spaces by spatial approximation,Searching in metric spaces by spatial approximation,1.0
36,999748,journals/vldb/RafieiM02,767094,Efficient retrieval of similar shapes,Efficient retrieval of similar shapes,1.0
37,999787,journals/vldb/SaltenisJ02,767093,Indexing of now-relative spatio-bitemporal data,Indexing of now-relative spatio-bitemporal data,1.0
38,1001498,journals/vldb/RamamrithamC96,765756,A Taxonomy of Correctness Criteria in Database Applications,A taxonomy of correctness criteria in database applications,0.7258064516129032
39,1004132,journals/vldb/HarderR96,765805,Access Path Support for Referential Integrity in SQL2,Access path support for referential integrity in SQL2,0.7777777777777778
40,1012856,journals/vldb/AmielBDS96,765692,Type-safe Relaxing of Schema Consistency Rules for Flexible Modeling in OODBMS,Type-safe relaxing of schema consistency rules for flexible modelling in OODBMS,0.717948717948718
41,1014627,journals/vldb/BernsteinIR03,765219,Guest editorial,Guest editorial,1.0
42,1014649,journals/vldb/AtluriJY03,765219,Guest editorial,Guest editorial,1.0
43,1014763,journals/vldb/AbbadiSW01,765219,Guest editorial,Guest editorial,1.0
