,_id,l_id,r_id,l_title,r_title,_sim_score
398,845223,conf/vldb/PoosalaI96,673321,Estimation of Query-Result Distribution and its Application in Parallel-Join Load Balancing,Estimation of Query-Result Distribution and its Application in Parallel-Join Load Balancing,1.0
399,846113,conf/vldb/AcharyaFZ96,673323,Disseminating Updates on Broadcast Disks,Disseminating Updates on Broadcast Disks,1.0
400,847213,conf/vldb/Gupta96,673324,The Changing Landscape of the Software Industry and its Implications for India,The Changing Landscape of the Software Industry and its Implications for India,1.0
401,847353,conf/vldb/Gawlick96,673334,Scalablity and Availability in Oracle7 7.3,Scalablity and Availability in Oracle7 7.3,1.0
402,848726,journals/tods/ChaudhuriS99,673461,Optimization of Queries with User-Defined Predicates,Optimization of Queries with User-defined Predicates,0.8113207547169812
403,848941,conf/vldb/ChaudhuriS96,673461,Optimization of Queries with User-defined Predicates,Optimization of Queries with User-defined Predicates,1.0
404,849440,conf/vldb/DarFJST96,673462,Semantic Data Caching and Replacement,Semantic Data Caching and Replacement,1.0
405,849785,conf/vldb/Raghavan96,673463,Loading the Data Warehouse Across Various Parallel Architectures,Loading the Data Warehouse Across Various Parallel Architectures,1.0
406,851128,conf/vldb/BouganimFV96,673330,Dynamic Load Balancing in Hierarchical Parallel Database Systems,Dynamic Load Balancing in Hierarchical Parallel Database Systems,1.0
407,851967,conf/vldb/LeeL96,673331,Further Improvements on Integrity Constraint Checking for Stratifiable Deductive Databases,Further Improvements on Integrity Constraint Checking for Stratifiable Deductive Databases,1.0
408,852949,conf/vldb/Levy96,673332,Obtaining Complete Answers from Incomplete Databases,Obtaining Complete Answers from Incomplete Databases,1.0
409,853550,conf/vldb/RamakrishnanR96,673333,Modeling Design Versions,Modeling Design Versions,1.0
410,854157,conf/vldb/CabreraRH95,673308,Applying Database Technology in the ADSM Mass Storage System,Applying Database Technology in the ADSM Mass Storage System,1.0
411,855601,conf/vldb/MogiK95,673307,Hot Block Clustering for Disk Arrays with Dynamic Striping,Hot Block Clustering for Disk Arrays with Dynamic Striping,1.0
412,855973,conf/vldb/FlodinR95,673311,Processing Object-Oriented Queries with Invertible Late Bound Functions,Processing Object-Oriented Queries with Invertible Late Bound Functions,1.0
413,857376,conf/vldb/TreschPL95,673309,Type Classification of Semi-Structured Documents,Type Classification of Semi-Structured Documents,1.0
414,857827,conf/vldb/SrikantA95,673304,Mining Generalized Association Rules,Mining Generalized Association Rules,1.0
415,858633,conf/vldb/SeligmanBNSW95,673303,Metrics for Accessing Heterogeneous Data: Is There Any Hope? (Panel),Metrics for Accessing Heterogeneous Data: Is There Any Hope? (Panel),1.0
416,859710,conf/vldb/Madnick95,673306,From VLDB to VMLDB (Very MANY Large Data Bases): Dealing with Large-Scale Semantic Heterogenity,From VLDB to VMLDB (Very MANY Large Data Bases): Dealing with Large-Scale Semantic Heterogenity,1.0
417,860025,conf/vldb/KornackerB95,673305,High-Concurrency Locking in R-Trees,High-Concurrency Locking in R-Trees,1.0
418,860856,conf/vldb/LeslieJBY95,673317,Efficient Search of Multi-Dimensional B-Trees,Efficient Search of Multi-Dimensional B-Trees,1.0
419,861312,conf/vldb/EvangelidisLS95,673316,"The hBP-tree: A Modified hB-tree Supporting Concurrency, Recovery and Node Consolidation","The hBP-tree: A Modified hB-tree Supporting Concurrency, Recovery and Node Consolidation",1.0
420,861766,conf/vldb/SimonD95,673319,Promises and Realities of Active Database Systems,Promises and Realities of Active Database Systems,1.0
421,862916,conf/vldb/ReuterCGSW95,673318,Databases and Workflow Management: What is it All About? (Panel),Databases and Workflow Management: What is it All About? (Panel),1.0
422,864101,conf/vldb/DidriksenGD95,673313,Database De-Centralization - A Practical Approach,Database De-Centralization - A Practical Approach,1.0
423,865605,conf/vldb/ChaudhuriGS95,673312,Retrieval of Composite Multimedia Objects,Retrieval of Composite Multimedia Objects,1.0
424,866453,conf/vldb/KalusD95,673315,Flexible Relations - Operational Support of Variant Relational Structures,Flexible Relations - Operational Support of Variant Relational Structures,1.0
425,867631,conf/vldb/FerrandinaMZFM95,673314,Schema and Database Evolution in the O2 Object Database System,Schema and Database Evolution in the O2 Object Database System,1.0
426,868684,conf/vldb/FaloutsosG96,673487,Analysis of n-Dimensional Quadtrees using the Hausdorff Fractal Dimension,Analysis of n-Dimensional Quadtrees using the Hausdorff Fractal Dimension,1.0
427,869279,conf/vldb/Suciu96a,673488,Implementation and Analysis of a Parallel Collection Query Language,Implementation and Analysis of a Parallel Collection Query Language,1.0
428,870105,conf/vldb/GardarinST96,673485,"Calibrating the Query Optimizer Cost Model of IRO-DB, an Object-Oriented Federated Database System","Calibrating the Query Optimizer Cost Model of IRO-DB, an Object-Oriented Federated Database System",1.0
429,870933,conf/vldb/Sacks-Davis96,673486,The Structured Information Manager: A Database System for SGML Documents,The Structured Information Manager: A Database System for SGML Documents,1.0
430,871493,conf/vldb/Klots96,673483,Cache Coherency in Oracle Parallel Server,Cache Coherency in Oracle Parallel Server,1.0
431,871989,conf/vldb/GardarinGT96,673484,Cost-based Selection of Path Expression Processing Algorithms in Object-Oriented Databases,Cost-based Selection of Path Expression Processing Algorithms in Object-Oriented Databases,1.0
432,872640,conf/vldb/PapakonstantinouAG96,673481,Object Fusion in Mediator Systems,Object Fusion in Mediator Systems,1.0
433,872929,conf/vldb/GuptaM96,673482,What is the Data Warehousing Problem? (Are Materialized Views the Answer?),What is the Data Warehousing Problem? (Are Materialized Views the Answer?),1.0
434,873952,conf/vldb/FukudaMMT96,673495,Constructing Efficient Decision Trees by Using Optimized Numeric Association Rules,Constructing Efficient Decision Trees by Using Optimized Numeric Association Rules,1.0
435,874873,conf/vldb/IoannidisLGP96,673496,ZOO : A Desktop Experiment Management Environment,ZOO: A Desktop Experiment Management Environment,0.851063829787234
436,875626,conf/vldb/KornSFSP96,673493,Fast Nearest Neighbor Search in Medical Image Databases,Fast Nearest Neighbor Search in Medical Image Databases,1.0
437,876993,conf/vldb/ShuklaDNR96,673494,Storage Estimation for Multidimensional Aggregates in the Presence of Hierarchies,Storage Estimation for Multidimensional Aggregates in the Presence of Hierarchies,1.0
438,877335,conf/vldb/ShaferAM96,673491,SPRINT: A Scalable Parallel Classifier for Data Mining,SPRINT: A Scalable Parallel Classifier for Data Mining,1.0
439,878466,conf/vldb/Sheth96,673492,Bellcore's ADAPT/X Harness System for Managing Information on Internet and Intranets,Bellcore's ADAPT/X Harness System for Managing Information on Internet and Intranets,1.0
440,879871,conf/vldb/Sullivan96,673489,Tribeca: A Stream Database Manager for Network Traffic Analysis,Tribeca: A Stream Database Manager for Network Traffic Analysis,1.0
441,880563,conf/vldb/LakshmananSS96,673490,SchemaSQL - A Language for Interoperability in Relational Multi-Database Systems,SchemaSQL - A Language for Interoperability in Relational Multi-Database Systems,1.0
442,881790,conf/vldb/Celis96,673471,The Query Optimizer in Tandem's new ServerWare SQL Product,The Query Optimizer in Tandem's new ServerWare SQL Product,1.0
443,882506,conf/vldb/Bhashyam96,673470,"TPC-D: The Challenges, Issues and Results","TPC-D: The Challenges, Issues and Results",1.0
444,883739,conf/vldb/LevyRO96,673469,Querying Heterogeneous Information Sources Using Source Descriptions,Querying Heterogeneous Information Sources Using Source Descriptions,1.0
445,884199,conf/vldb/ShethKMWDLPLS96,673468,Supporting State-Wide Immunisation Tracking Using Multi-Paradigm Workflow Technology,Supporting State-Wide Immunisation Tracking Using Multi-Paradigm Workflow Technology,1.0
446,884680,conf/vldb/Mattos96,673467,Supporting Procedural Constructs in SQL Compilers,Supporting Procedural Constructs in SQL Compilers,1.0
447,886412,conf/vldb/SevcikK96,673466,Filter Trees for Managing Spatial Data over a Range of Size Granularities,Filter Trees for Managing Spatial Data over a Range of Size Granularities,1.0
448,886778,conf/vldb/CareyD96,673465,Of Objects and Databases: A Decade of Turmoil,Of Objects and Databases: A Decade of Turmoil,1.0
449,887537,conf/vldb/ViverosNR96,673464,Applying Data Mining Techniques to a Health Insurance Information System,Applying Data Mining Techniques to a Health Insurance Information System,1.0
450,888366,conf/vldb/BerckenS96,673480,Query Processing Techniques for Multiversion Access Methods,Query Processing Techniques for Multiversion Access Methods,1.0
451,889998,conf/vldb/StaudtJ96,673479,Incremental Maintenance of Externally Materialized Views,Incremental Maintenance of Externally Materialized Views,1.0
452,891028,conf/vldb/MiningGroup96,673478,MineSet(tm): A System for High-End Data Mining and Visualization,MineSet(tm): A System for High-End Data Mining and Visualization,1.0
453,891666,conf/vldb/LabioG96,673477,Efficient Snapshot Differential Algorithms for Data Warehousing,Efficient Snapshot Differential Algorithms for Data Warehousing,1.0
454,893387,conf/vldb/McKennaBHT96,673476,EROC: A Toolkit for Building NEATO Query Optimizers,EROC: A Toolkit for Building NEATO Query Optimizers,1.0
455,893749,conf/vldb/BertinoBFS96,673475,Supporting Periodic Authorizations and Temporal Reasoning in Database Access Control,Supporting Periodic Authorizations and Temporal Reasoning in Database Access Control,1.0
456,894745,conf/vldb/BohlenSS96,673474,Coalescing in Temporal Databases,Coalescing in Temporal Databases,1.0
457,895584,conf/vldb/Kleewein96,673472,Practical Issues with Commercial Use of Federated Databases,Practical Issues with Commercial Use of Federated Databases,1.0
0,916726,journals/vldb/Halevy02,765530,Guest Editorial,Guest Editorial,1.0
1,920308,journals/vldb/HjaltasonS02,767129,Speeding up construction of PMR quadtree-based spatial indexes,Speeding up construction of PMR quadtree-based spatial indexes,1.0
2,921307,journals/vldb/SakuraiYUK02,767128,Spatial indexing of high-dimensional data based on relative approximation,Spatial indexing of high-dimensional data based on relative approximation,1.0
3,921710,journals/vldb/MaratheS02,767098,Query processing techniques for arrays,Query processing techniques for arrays,1.0
4,922223,journals/vldb/FerrariAABC02,767097,An authorization system for digital libraries,An authorization system for digital libraries,1.0
5,923566,journals/vldb/MecellaP01,767134,Designing wrapper components for e-services in integrating heterogeneous systems,Designing wrapper components for e-services in integrating heterogeneous systems,1.0
6,923590,journals/vldb/BernsteinIR03,767133,Guest editorial,Guest editorial,1.0
7,923600,journals/vldb/AtluriJY03,767133,Guest editorial,Guest editorial,1.0
8,923630,journals/vldb/AbbadiSW01,767133,Guest editorial,Guest editorial,1.0
9,923644,journals/vldb/Atkinson00,767133,Guest editorial,Guest editorial,1.0
10,924078,journals/vldb/FengYLH02,767131,A template model for multidimensional inter-transactional association rules,A template model for multidimensional inter-transactional association rules,1.0
11,925138,journals/vldb/NanopoulosM02,767130,Efficient similarity search for market basket data,Efficient similarity search for market basket data,1.0
12,929375,journals/vldb/MihailaRT02,767096,Locating and accessing data repositories with WebSemantics,Locating and accessing data repositories with WebSemantics,1.0
13,930172,journals/vldb/Navarro02,767095,Searching in metric spaces by spatial approximation,Searching in metric spaces by spatial approximation,1.0
14,931399,journals/vldb/RafieiM02,767094,Efficient retrieval of similar shapes,Efficient retrieval of similar shapes,1.0
15,931428,journals/vldb/SaltenisJ02,767093,Indexing of now-relative spatio-bitemporal data,Indexing of now-relative spatio-bitemporal data,1.0
16,946523,journals/vldb/BernsteinIR03,765219,Guest editorial,Guest editorial,1.0
17,946533,journals/vldb/AtluriJY03,765219,Guest editorial,Guest editorial,1.0
18,946563,journals/vldb/AbbadiSW01,765219,Guest editorial,Guest editorial,1.0
19,946577,journals/vldb/Atkinson00,765219,Guest editorial,Guest editorial,1.0
20,955532,journals/vldb/IvesHW02,764206,An XML query engine for network-bound data,An XML query engine for network-bound data,1.0
21,956301,journals/vldb/ChanFGR02,764205,Efficient filtering of XML documents with XPath expressions,Efficient filtering of XML documents with XPath expressions,1.0
22,957759,journals/vldb/JagadishACLNPPSWWY02,764201,TIMBER: A native XML database,TIMBER: A native XML database,1.0
23,958186,journals/vldb/FiebigHKMNSW02,764202,Anatomy of a native XML base management system,Anatomy of a native XML base management system,1.0
24,958763,journals/vldb/Amer-YahiaCLS02,764203,Tree pattern query minimization,Tree pattern query minimization,1.0
25,959112,journals/vldb/ChienTZ02,764204,Efficient schemes for managing multiversionXML documents,Efficient schemes for managing multiversionXML documents,1.0
26,960778,journals/tods/BeneventanoBS03,762472,Description logics for semantic query optimization in object-oriented database systems,Description logics for semantic query optimization in object-oriented database systems,1.0
27,961255,journals/tods/KarpSP03,762473,A simple algorithm for finding frequent elements in streams and bags,A simple algorithm for finding frequent elements in streams and bags,1.0
28,962397,journals/tods/MelnikG03,762474,Adaptive algorithms for set containment joins,Adaptive algorithms for set containment joins,1.0
29,962784,journals/vldb/Halevy02,764200,Guest Editorial,Guest Editorial,1.0
30,962848,conf/vldb/ChristopheBPV00,758380,PicoDMBS: Scaling Down Database Techniques for the Smartcard,PicoDMBS: Scaling Down Database Techniques for the Smartcard,1.0
31,964233,conf/vldb/AnciauxBBPV01,758381,PicoDBMS: Validation and Experience,PicoDBMS: Validation and Experience,1.0
32,965504,conf/vldb/MargaritisFT01,758382,NetCube: A Scalable Tool for Fast Data Mining and Compression,NetCube: A Scalable Tool for Fast Data Mining and Compression,1.0
33,965635,conf/vldb/Adler01,758383,DB2 Spatial Extender - Spatial data within the RDBMS,DB2 Spatial Extender - Spatial data within the RDBMS,1.0
34,966460,conf/vldb/Norvag99,758375,The Persistent Cache: Improving OID Indexing in Temporal Object-Oriented Database Systems,The Persistent Cache: Improving OID Indexing in Temporal Object-Oriented Database Systems,1.0
35,967337,conf/vldb/YuV00,758377,Efficient Numerical Error Bounding for Replicated Network Services,Efficient Numerical Error Bounding for Replicated Network Services,1.0
36,968312,conf/vldb/ChakrabartiSST00,758378,Memex: A Browsing Assistant for Collaborative Archiving and Mining of Surf Trails,Memex: A Browsing Assistant for Collaborative Archiving and Mining of Surf Trails,1.0
37,968945,conf/vldb/YagoubFIV00a,758379,Building and Customizing Data-Intensive Web Sites Using Weave,Building and Customizing Data-Intensive Web Sites Using Weave,1.0
38,978690,journals/vldb/WangW01,765508,Indexing very high-dimensional sparse and quasi-sparse vectors for similarity searches,Indexing very high-dimensional sparse and quasi-sparse vectors for similarity searches,1.0
39,979786,journals/vldb/LeeSC01,765507,A graph-theoretic model for optimizing queries involving methods,A graph-theoretic model for optimizing queries involving methods,1.0
40,980049,journals/vldb/CombiP01,765505,HMAP - A temporal data model managing intervals with different granularities and indeterminacy from natural language sentences,HMAP- A temporal data model managing intervals with different granularities and indeterminacy from natural language sentences,0.9285714285714286
41,981132,journals/vldb/LiCHH01,765506,Supporting efficient multimedia database exploration,Supporting efficient multimedia database exploration,1.0
42,981364,journals/vldb/TanGO00,765240,Progressive evaluation of nested aggregate queries,Progressive evaluation of nested aggregate queries,1.0
43,982809,journals/vldb/NguSHL01,765504,Combining multi-visual features for efficient indexing in a large image database,Combining multi-visual features for efficient indexing in a large image database,1.0
44,983256,journals/vldb/ManegoldBK00,765238,Optimizing database architecture for the new bottleneck: memory access,Optimizing database architecture for the new bottleneck: memory access,1.0
45,984134,journals/vldb/RamanRH00,765239,Online dynamic reordering,Online dynamic reordering,1.0
46,984785,journals/vldb/ClaussenKKW00,765236,Exploiting early sorting and early partitioning for decisionsupport query processing,Exploiting early sorting and early partitioning for decision support query processing,0.8888888888888888
47,985988,journals/vldb/JagadishKNS00,765237,One-dimensional and multi-dimensional substring selectivity estimation,One-dimensional and multi-dimensional substring selectivity estimation,1.0
48,986028,journals/vldb/BernsteinIR03,765234,Guest editorial,Guest editorial,1.0
49,986038,journals/vldb/AtluriJY03,765234,Guest editorial,Guest editorial,1.0
50,986068,journals/vldb/AbbadiSW01,765234,Guest editorial,Guest editorial,1.0
51,986082,journals/vldb/Atkinson00,765234,Guest editorial,Guest editorial,1.0
52,986800,journals/vldb/BernsteinPS00,765235,Context-based prefetch - an optimization for implementing objects on relations,Context-based prefetch - an optimization for implementing objects on relations,1.0
53,992458,conf/vldb/DongHLPW01,672176,Mining Multi-Dimensional Constrained Gradients in Data Cubes,Mining Multi-Dimensional Constrained Gradients in Data Cubes,1.0
54,993066,conf/vldb/AgrawalSX01,672175,Storage and Querying of E-Commerce Data,Storage and Querying of E-Commerce Data,1.0
55,993943,conf/vldb/GilbertKMS01,672174,Surfing Wavelets on Streams: One-Pass Summaries for Approximate Aggregate Queries,Surfing Wavelets on Streams: One-Pass Summaries for Approximate Aggregate Queries,1.0
56,994546,conf/vldb/AksoyZF01,672046,Data Staging for On-Demand Broadcast,Data Staging for On-Demand Broadcast,1.0
57,995024,conf/vldb/CherniackFZ01,672180,Data Management for Pervasive Computing,Data Management for Pervasive Computing,1.0
58,995546,conf/vldb/BlokWZPAKJ01,672179,Flexible and scalable digital library search,Flexible and scalable digital library search,1.0
59,997243,conf/vldb/OoiYTJ01,672178,Indexing the Distance: An Efficient Method to KNN Processing,Indexing the Distance: An Efficient Method to KNN Processing,1.0
60,998023,conf/vldb/OzsuLON01,672177,An Extendible Hash for Multi-Precision Similarity Querying of Image Databases,An Extendible Hash for Multi-Precision Similarity Querying of Image Databases,1.0
61,998677,conf/vldb/OConnellWG01,672185,Collaborative Analytical Processing - Dream or Reality? (Panel abstract),Collaborative Analytical Processing - Dream or Reality? (Panel abstract),1.0
62,999787,conf/vldb/Kotidis01,672183,A Data Warehousing Architecture for Enabling Service Provisioning Process,A Data Warehousing Architecture for Enabling Service Provisioning Process,1.0
63,1000549,conf/vldb/BunkerCCMMW01,672182,Aggregate Maintenance for Data Warehousing in Informix Red Brick Vista,Aggregate Maintenance for Data Warehousing in Informix Red Brick Vista,1.0
64,1001175,conf/vldb/DillKMRST01,672181,Self-similarity in the Web,Self-similarity in the Web,1.0
65,1001676,conf/vldb/BaumgartnerFG01a,672189,Supervised Wrapper Generation with Lixto,Supervised Wrapper Generation with Lixto,1.0
66,1002837,conf/vldb/UrhanF01,672188,Dynamic Pipeline Scheduling for Improving Interactive Query Performance,Dynamic Pipeline Scheduling for Improving Interactive Query Performance,1.0
67,1003070,conf/vldb/MorishimaKKT01,672187,Enabling End-users to Construct Data-intensive Web-sites from XML Repositories: An Example-based Approach,Enabling End-users to Construct Data-intensive Web-sites from XML Repositories: An Example-based Approach,1.0
68,1003733,conf/vldb/AmbiteKKMST01,672186,The WorlInfo Assistant: Spatio-Temporal Information Integration on the Web,The WorlInfo Assistant: Spatio-Temporal Information Integration on the Web,1.0
69,1004263,conf/vldb/VeltriCV01,672192,Views in a Large Scale XML Repository,Views in a Large Scale XML Repository,1.0
70,1006056,conf/vldb/YangG01,672193,Comparing Hybrid Peer-to-Peer Systems,Comparing Hybrid Peer-to-Peer Systems,1.0
71,1007070,conf/vldb/CasatiDGS01,672190,"Improving Business Process Quality through Exception Understanding, Prediction, and Prevention","Improving Business Process Quality through Exception Understanding, Prediction, and Prevention",1.0
72,1008578,conf/vldb/MadhavanBR01,672191,Generic Schema Matching with Cupid,Generic Schema Matching with Cupid,1.0
73,1009823,conf/vldb/BerckenS01,672197,An Evaluation of Generic Bulk Loading Techniques,An Evaluation of Generic Bulk Loading Techniques,1.0
74,1012055,conf/vldb/BohmMSW01,672198,Fast Evaluation Techniques for Complex Similarity Queries,Fast Evaluation Techniques for Complex Similarity Queries,1.0
75,1013530,conf/vldb/BaumgartnerFG01,672194,Visual Web Information Extraction with Lixto,Visual Web Information Extraction with Lixto,1.0
76,1014165,conf/vldb/PereiraFJLS01,672195,WebFilter: A High-throughput XML-based Publish and Subscribe System,WebFilter: A High-throughput XML-based Publish and Subscribe System,1.0
77,1016280,conf/vldb/BouguettayaEMO01,672201,Ontology-based Support for Digital Government,Ontology-based Support for Digital Government,1.0
78,1016753,conf/vldb/CooperSFHS01,672202,A Fast Index for Semistructured Data,A Fast Index for Semistructured Data,1.0
79,1017755,conf/vldb/CareyKRLABFLOPQRSSUVWY01,672199,The Propel Distributed Services Platform,The Propel Distributed Services Platform,1.0
80,1018012,conf/vldb/GravanoIJKMS01,672200,Approximate String Joins in a Database (Almost) for Free,Approximate String Joins in a Database (Almost) for Free,1.0
81,1019626,conf/vldb/MignetMAC01,672205,Change-Centric Management of Versions in an XML Warehouse,Change-Centric Management of Versions in an XML Warehouse,1.0
82,1021759,conf/vldb/ZhouLZLZJT01,672206,VXMLR: A Visual XML-Relational Database System,VXMLR: A Visual XML-Relational Database System,1.0
83,1023320,conf/vldb/ShanmugasundaramKSFF01,672203,Querying XML Views of Relational Data,Querying XML Views of Relational Data,1.0
84,1024455,conf/vldb/WiesnerK01,672204,Hyperqueries: Dynamic Distributed Query Processing on the Internet,Hyperqueries: Dynamic Distributed Query Processing on the Internet,1.0
85,1025736,conf/vldb/StohrR01,672208,WARLOCK: A Data Allocation Tool for Parallel Warehouses,WARLOCK: A Data Allocation Tool for Parallel Warehouses,1.0
86,1025907,conf/vldb/StanoiRAA01,672207,Discovery of Influence Sets in Frequently Updated Databases,Discovery of Influence Sets in Frequently Updated Databases,1.0
87,1027494,conf/vldb/CatozziR01,672210,Operating System Extensions for the Teradata Parallel VLDB,Operating System Extensions for the Teradata Parallel VLDB,1.0
88,1028088,conf/vldb/FegarasE01,672209,Query Engines for Web-Accessible XML Data,Query Engines for Web-Accessible XML Data,1.0
89,1029232,conf/vldb/BonifatiCDS01,672212,Warehousing Workflow Data: Challenges and Opportunities,Warehousing Workflow Data: Challenges and Opportunities,1.0
90,1029869,conf/vldb/DayalHL01,672211,"Business Process Coordination: State of the Art, Trends, and Open Issues","Business Process Coordination: State of the Art, Trends, and Open Issues",1.0
91,1031336,conf/vldb/AmirKN01,672215,Analyzing Quantitative Databases: Image is Everything,Analyzing Quantitative Databases: Image is Everything,1.0
92,1032346,conf/vldb/NarayananS01,672213,Tavant System Architecture for Sell-side Channel Management,Tavant System Architecture for Sell-side Channel Management,1.0
93,1033337,conf/vldb/TanEO01,672217,Efficient Progressive Skyline Computation,Efficient Progressive Skyline Computation,1.0
94,1033811,conf/vldb/ChirkovaHS01,672216,A Formal Perspective on the View Selection Problem,A Formal Perspective on the View Selection Problem,1.0
95,1034948,conf/vldb/BratsbergH01,672348,Online Scaling in a Highly Available Database,Online Scaling in a Highly Available Database,1.0
96,1035899,conf/vldb/ChungCLL01,672347,Dynamic Update Cube for Range-sum Queries,Dynamic Update Cube for Range-sum Queries,1.0
97,1036526,conf/vldb/NishioSTTL01,672350,Functional Properties of Information Filtering,Functional Properties of Information Filtering,1.0
98,1037324,conf/vldb/StillgerLMK01,672349,LEO - DB2's LEarning Optimizer,LEO - DB2's LEarning Optimizer,1.0
99,1037546,conf/vldb/OzdenGHNSDGGW01,672352,Storage Service Providers: a Solution for Storage Management? (Panel),Storage Service Providers: a Solution for Storage Management? (Panel),1.0
100,1039059,conf/vldb/Gibbons01,672351,Distinct Sampling for Highly-Accurate Answers to Distinct Values Queries and Event Reports,Distinct Sampling for Highly-Accurate Answers to Distinct Values Queries and Event Reports,1.0
101,1039665,conf/vldb/TsurAADKW01,672353,Are Web Services the Next Revolution in e-Commerce? (Panel),Are Web Services the Next Revolution in e-Commerce? (Panel),1.0
102,1041045,conf/vldb/KoschBBHHLRT01,672354,SMOOTH - A Distributed Multimedia Database System,SMOOTH - A Distributed Multimedia Database System,1.0
103,1042290,conf/vldb/AbrolLMMMRTWZ01,672355,Navigating large-scale semi-structured data in business portals,Navigating large-scale semi-structured data in business portals,1.0
