,_id,l_id,r_id,l_title,r_title,_sim_score
356,1344971,conf/sigmod/BerensonBGMOO95,223785,A Critique of ANSI SQL Isolation Levels,A critique of ANSI SQL isolation levels,0.7209302325581395
357,1346719,conf/sigmod/AdyaGLM95,223787,Efficient Optimistic Concurrency Control Using Loosely Synchronized Clocks,Efficient optimistic concurrency control using loosely synchronized clocks,0.7
358,1347892,conf/sigmod/BrodskyK95,223788,The LyriC Language: Querying Constraint Objects,The LyriC language: querying constraint objects,0.7058823529411765
359,1349940,conf/sigmod/RoussopoulosKV95,223794,Nearest Neighbor Queries,Nearest neighbor queries,0.72
360,1350058,journals/sigmod/Bohlen95,219758,Temporal Database System Implementations,Temporal database system implementations,0.7
361,1351093,journals/sigmod/SegevJS95,219754,Report on The 1995 International Workshop on Temporal Databases,Report on the 1995 international workshop on temporal databases,0.7068965517241379
362,1352999,journals/sigmod/DrewHKKLLLSW95,219769,Data and Knowledge Base Research at Hong Kong University of Science and Technology,Data and knowledge base research at Hong Kong University of Science and Technology,0.8472222222222222
363,1354189,journals/sigmod/SellisV95,219766,The Database Group at National Technical University of Athens (NTUA),The database group at National Technical University of Athens (NTUA),0.875
364,1354320,journals/sigmod/Stacey95,219774,"Replication: DB2, Oracle, or Sybase?","Replication: DB2, Oracle, or Sybase?",1.0
365,1355057,journals/sigmod/Qian95b,219772,"Opportunities at ARPA, NSF, and Elsewhere","Opportunities at ARPA, NSF, and elsewhere",0.9
366,1355225,journals/sigmod/DunhamH95a,219727,Mobile Computing and Databases: Anything New?,Mobile computing and databases: anything new?,0.7021276595744681
367,1355853,journals/tods/SrivastavaSRN95,219056,Space Optimization in Deductive Databases,Space optimization in deductive databases,0.7435897435897436
368,1359513,journals/sigmod/WolfsonSDNR95,219737,View Maintenance in Mobile Computing,View maintenance in mobile computing,0.7222222222222222
369,1364489,conf/sigmod/GorelikWD94,191932,Sybase Replication Server,Sybase replication server,0.7307692307692307
370,1365249,conf/sigmod/Dietterich94,191931,DEC Data Distributor: for Data Replication and Data Warehousing,DEC data distributor: for data replication and data warehousing,0.7636363636363637
371,1367484,conf/sigmod/Carey94,191929,Parallel Database Systems in the 1990's,Parallel database systems in the 1990's,0.8048780487804879
372,1369523,conf/sigmod/Englert94,191945,NonStop SQL: Scalability and Availability for Decision Support,Nonstop SQL: scalability and availability for decision support,0.7142857142857143
373,1370946,conf/sigmod/Ballinger94,191944,Evolving Teradata Decision Support for Massively Parallel Processing with UNIX,Evolving teradata decision support for massively parallel processing with UNIX,0.717948717948718
374,1371100,conf/sigmod/Vaskevitch94,191942,Database in Crisis and Transition: A Technical Agenda for the Year 2001,Database in crisis and transition: a technical agenda for the year 2001,0.7536231884057971
375,1372631,conf/sigmod/Ubell94,191939,The Montage Extensible DataBlade Achitecture,The Montage extensible DataBlade architecture,0.7906976744186046
376,1373876,conf/sigmod/Cattell94,191937,ODMG-93: A Standard for Object-Oriented DBMSs,ODMG-93: a standard for object-oriented DBMSs,0.7
377,1374691,conf/sigmod/KemperMPS94,191906,Optimizing Disjunctive Queries with Expensive Predicates,Optimizing disjunctive queries with expensive predicates,0.7368421052631579
378,1374889,conf/sigmod/Galindo-Legaria94,191908,Outerjoins as Disjunctions,Outerjoins as disjunctions,0.84
379,1376286,conf/sigmod/Hellerstein94,191904,Practical Predicate Placement,Practical predicate placement,0.8076923076923077
380,1377997,conf/sigmod/ConsensM94,191898,Optimizing Queries on Files,Optimizing queries on files,0.7241379310344828
381,1380944,conf/sigmod/SeshadriLR94,191926,Sequence Query Processing,Sequence query processing,0.72
382,1381527,conf/sigmod/SagonasSW94,191927,XSB as an Efficient Deductive Database Engine,XSB as an efficient deductive database engine,0.75
383,1386342,conf/sigmod/DogacAEOADAOS94,197137,METU Object-Oriented DBMS,METU object-oriented DBMS,0.7142857142857143
384,1387612,journals/tods/Chen95,202110,Declarative Updates of Relational Databases,Declarative updates of relational databases,0.7317073170731707
385,1389173,conf/sigmod/Jagadish94,191991,Databases for Networks,Databases for networks,0.8181818181818182
386,1390650,journals/tods/KrishnakumarB94,195670,Bounded Ignorance: A Technique for Increasing Concurrency in a Replicated System,Bounded ignorance: a technique for increasing concurrency in a replicated system,0.7368421052631579
387,1394154,journals/sigmod/Jannink95,202666,Implementing Deletion in B+-Trees,Implementing deletion in B+-trees,0.75
388,1394402,journals/sigmod/Zhang95,202661,Application of OODB and SGML Techniques in Text Database: An Electronic Dictionary System,Application of OODB and SGML techniques in text database: an electronic dictionary system,0.775
389,1395367,journals/tods/Jagadish95,202113,The INCINERATE Data Model,The INCINERATE data model,0.7037037037037037
390,1395512,journals/sigmod/KarlapalemLS95,202663,HODFA: An Architectural Framework for Homogenizing Heterogeneous Legacy Database,HODFA: an architectural framework for homogenizing heterogeneous legacy databases,0.7108433734939759
391,1397049,journals/sigmod/DogacAOD95,202662,Implementation Aspects of an Object-Oriented DBMS,Implementation aspects of an object-oriented DBMS,0.7872340425531915
392,1401769,conf/sigmod/SinghTW94,191949,Relaxed Transaction Processing,Relaxed transaction processing,0.7575757575757576
393,1403575,conf/sigmod/BryanMCLG94,191955,The MEDUSA Project: Autonomous Data Management in a Shared-Nothing Parallel Database Machine,The MEDUSA project: autonomous data management in a shared-nothing parallel database machine,0.7386363636363636
394,1404693,conf/sigmod/HwangLYMMGCSS94,191986,The MYRIAD Federated Database Prototype,The MYRIAD federated database prototype,0.7
395,1406283,conf/sigmod/SagonasSW94a,191970,XSB as a Deductive Database,XSB as a deductive database,0.7692307692307693
396,1407528,conf/sigmod/CatarciS94,191976,Query by Diagram: A Graphical Environment for Querying Databases,Query by diagram: a graphical environment for querying databases,0.7076923076923077
397,1410308,journals/sigmod/Datta94,187442,Research Issues in Databases for ARCS: Active Rapidly Changing Data Systems,Research issues in databases for ARCS: Active Rapidly Changing data Systems,0.8939393939393939
398,1411096,journals/sigmod/Group94,187439,"Response to the March 1994 ODMG-93 Commentary Written by Dr. Won Kim of UniSQL, Inc","Response to the ODMG-93 commentary written by Dr. Won Kim of UniSQL, Inc.",0.7721518987341772
399,1414338,journals/sigmod/SnodgrassAABCDEGJKKKLLRSSS94a,187449,A TSQL2 Tutorial,A TSQL2 tutorial,0.8125
400,1414437,journals/sigmod/YeungHL94,187447,Performance Evaluation of a New Distributed Deadlock Detection Algorithm,Performance evaluation of a new distributed deadlock detection algorithm,0.7647058823529411
401,1415501,journals/sigmod/Qian94,187462,Jumping on the NII Bandwagon,Jumping on the NII bandwagon,0.8571428571428571
402,1415755,journals/sigmod/Chen94,187460,Database Research at NTHU and ITRI,Database research at NTHU and ITRI,0.875
403,1416240,journals/sigmod/RamirezSP94,187458,Medical Information Systems: Characterization and Challenges,Medical information systems: characterization and challenges,0.7818181818181819
404,1417530,journals/sigmod/Widom94,187457,Research Issues in Active Database Systems: Report from the Closing Panel at RIDE-ADS '94,Research issues in active database systems: report from the closing panel at RIDE-ADS '94,0.7362637362637363
405,1418471,journals/sigmod/BohmR94,190635,Metadata for Multimedia Documents,Metadata for multimedia documents,0.7575757575757576
406,1418932,journals/sigmod/Bertram94,190631,Data Modelling in the Large,Data modelling in the large,0.7241379310344828
407,1422653,journals/sigmod/DreyerDS94,181553,Research Perspectives for Time Series Management Systems,Research perspectives for time series management systems,0.7222222222222222
408,1423780,journals/sigmod/SnodgrassAABCDEGJKKKLLRSSS94,181562,TSQL2 Language Specification,TSQL2 language specification,0.7419354838709677
409,1423948,journals/sigmod/BunemanLSTW94,181564,Comprehension Syntax,Comprehension syntax,0.8095238095238095
410,1424902,journals/sigmod/PissinouSEMOPSTD94,181557,Towards an Infrastructure for Temporal Databases: Report of an Invitational ARPA/NSF Workshop,Towards an infrastructure for temporal databases: report of an invitational ARPA/NSF workshop,0.7790697674418605
411,1426282,journals/sigmod/NorrieBSW94,181567,The Database Research Group at ETH Zurich,The database research group at ETH Zurich,0.7142857142857143
412,1427275,journals/sigmod/Gallagher94,181568,Influencing Database Language Standards,Influencing database language standards,0.717948717948718
413,1428371,journals/sigmod/MedeirosP94,181566,Databases for GIS,Databases for GIS,1.0
414,1429967,journals/tods/ChrysanthisR94,185843,Synthesis of Extended Transaction Models Using ACTA,Synthesis of extended transaction models using ACTA,0.7090909090909091
415,1430436,journals/sigmod/Winslett94,181569,Progress on HPCC and NII,Progress on HPCC and NII,1.0
416,1431206,journals/tods/CeriFPT94,185828,Automatic Generation of Production Rules for Integrity Maintenance,Automatic generation of production rules for integrity maintenance,0.71875
417,1432255,conf/sigmod/BersonGMJ94,191852,Staggered Striping in Multimedia Information Systems,Staggered striping in multimedia information systems,0.7959183673469388
418,1433189,conf/sigmod/WangCMSSZ94,191863,Combinatorial Pattern Discovery for Scientific Data: Some Preliminary Results,Combinatorial pattern discovery for scientific data: some preliminary results,0.726027397260274
419,1434512,conf/sigmod/MumickP94,191860,Implementation of Magic-sets in a Relational Database System,Implementation of magic-sets in a relational database system,0.7241379310344828
0,1435779,conf/sigmod/IoannidisL94,191870,Incomplete Path Expressions and their Disambiguation,Incomplete path expressions and their disambiguation,0.7735849056603774
1,1436556,conf/sigmod/GravanoGT94,191869,The Effectiveness of GlOSS for the Text Database Discovery Problem,The effectiveness of GIOSS for the text database discovery problem,0.7
2,1439875,journals/vldb/SwamiS95,191877,Estimating Page Fetches for Index Scans with Finite LRU Buffers,Estimating page fetches for index scans with finite LRU buffers,0.703125
3,1439921,conf/sigmod/SwamiS94,191877,Estimating Page Fetches for Index Scans with Finite LRU Buffers,Estimating page fetches for index scans with finite LRU buffers,0.703125
4,1443239,conf/sigmod/VingralekBW94,191889,Distributed File Organization with Scalable Cost/Performance,Distributed file organization with scalable cost/performance,0.703125
5,1444846,journals/sigmod/JainH94,190638,Metadata in Video Databases,Metadata in video databases,0.7307692307692307
6,1445443,journals/sigmod/KiyokiKH94,190639,A Metadatabase System for Semantic Image Search by a Mathematical Model of Meaning,A metadatabase system for semantic image search by a mathematical model of meaning,0.7647058823529411
7,1447496,journals/sigmod/GroskyFS94,190644,Using Metadata for the Intelligent Browsing of Structured Media Objects,Using metadata for the intelligent browsing of structured media objects,0.7313432835820896
8,1448745,journals/sigmod/GlavitschSW94,190645,Metadata for Integrating Speech Documents in a Text Retrieval System,Metadata for integrating speech documents in a text retrieval system,0.7164179104477612
9,1450268,journals/sigmod/BarclayBGS94,190647,Loading Databases Using Dataflow Parallelism,Loading databases using dataflow parallelism,0.7142857142857143
10,1450360,journals/sigmod/MattosD94,190648,Recent Design Trade-offs in SQL3,Recent design trade-offs in SQL3,0.7878787878787878
11,1452764,journals/vldb/BarbaraI95,191844,Sleepers and Workaholics: Caching Strategies in Mobile Environments,Sleepers and workaholics: caching strategies in mobile environments,0.7361111111111112
12,1452767,conf/sigmod/BarbaraI94,191844,Sleepers and Workaholics: Caching Strategies in Mobile Environments,Sleepers and workaholics: caching strategies in mobile environments,0.7361111111111112
13,1453389,conf/sigmod/HuangSW94,191845,Data Replication for Mobile Computers,Data replication for mobile computers,0.7073170731707317
14,1456978,conf/sigmod/ZhangNBB94,191850,Ensuring Relaxed Atomicity for Flexible Transactions in Multidatabase Systems,Ensuring relaxed atomicity for flexible transactions in multidatabase systems,0.725
15,1458472,journals/sigmod/GuptaHR97,271093,Virtual Database technology,Virtual database technology,0.8571428571428571
16,1459274,journals/sigmod/ConradEHRSSSV97,271089,Research Issues in Federated Database Systems: Report of EFDBS '97 Workshop,Research issues in federated database systems: report of EFDBS '97 workshop,0.717948717948718
17,1460625,journals/sigmod/JajodiaBBKMSW97,271095,Information Systems Research at George Mason University,Information systems research at George Mason University,0.8518518518518519
18,1462532,journals/sigmod/NadoH97,271083,Extracting Entity Profiles from Semistructured Information Spaces,Extracting entity profiles from semistructured information spaces,0.734375
19,1463922,journals/sigmod/McHughW97,271082,Integrating Dynamically-Fetched External Information into a DBMS for Semistructured Data,Integrating dynamically-fetched external information into a DBMS for semistructured data,0.775
20,1465610,journals/sigmod/NestorovAM97,271084,Infering Structure in Semistructured Data,Inferring structure in semistructured data,0.7222222222222222
21,1467706,journals/sigmod/Konig-RiesL97,262771,"Research in Databases and Data-Intensive Applications - Computer Science Department and FZI, University of Karlsruhe","Research in databases and data-intensive applications: Computer Science Dept. and FIZ, University of Karlsruhe",0.7352941176470589
22,1469308,journals/sigmod/AshishK97,271078,Wrapper Generation for Semi-structured Internet Sources,Wrapper generation for semi-structured Internet sources,0.8076923076923077
23,1470632,journals/sigmod/JukicV97,262767,Asserting Beliefs in MLS Relational Models,Asserting beliefs in MLS relational models,0.7380952380952381
24,1471374,journals/sigmod/RamamrithamS97,262769,Report on DART '96: Databases: Active and Real-Time (Concepts meet Practice),Report on DART '96: databases: active and real-time (concepts meet practice),0.7397260273972602
25,1473185,journals/sigmod/Bernstein98,273271,Repositories and Object Oriented Databases,Repositories and object oriented databases,0.775
26,1477643,journals/sigmod/KoksalAD98,273265,Workflow History Management,Workflow history management,0.7241379310344828
27,1478715,journals/sigmod/Roussopoulos98,273253,Materialized Views and Data Warehouses,Materialized views and data warehouses,0.7073170731707317
28,1479599,journals/sigmod/BurtonM98,273254,Applications of the JAVA Programming Language to Database Management,Applications of JAVA programming language to database management,0.7313432835820896
29,1480605,journals/sigmod/GatziuKBF98,273255,Unbundling Active Functionality,Unbundling active functionality,0.7333333333333333
30,1483532,journals/sigmod/MusickM98,273249,Report on the Second IEEE Metadata Conference (Metadata '97),Report on the second IEEE metadata conference (Metadata '97),0.803921568627451
31,1485031,conf/sigmod/KanthAS98,276320,Dimensionality Reduction for Similarity Searching in Dynamic Databases,Dimensionality reduction for similarity searching in dynamic databases,0.7741935483870968
32,1492947,conf/sigmod/CherniackZ98,276311,Changing the Rules: Transformations for Rule-Based Optimizers,Changing the rules: transformations for rule-based optimizers,0.7368421052631579
33,1495855,conf/sigmod/ShintaniK98,276308,Parallel Mining Algorithms for Generalized Association Rules with Classification Hierarchy,Parallel mining algorithms for generalized association rules with classification hierarchy,0.7073170731707317
34,1499282,conf/sigmod/ChanI98,276336,Bitmap Index Design and Evaluation,Bitmap index design and evaluation,0.7027027027027027
35,1502926,conf/sigmod/ChakrabartiDI98,276332,Enhanced Hypertext Categorization Using Hyperlinks,Enhanced hypertext categorization using hyperlinks,0.7446808510638298
36,1505811,conf/sigmod/NestorovAM98,276331,Extracting Schema from Semistructured Data,Extracting schema from semistructured data,0.7619047619047619
37,1507622,conf/sigmod/ZhaoDNS98,276329,Simultaneous Optimization and Evaluation of Multiple Dimensional Queries,Simultaneous optimization and evaluation of multiple dimensional queries,0.71875
38,1508427,conf/sigmod/HjaltasonS98,276326,Incremental Distance Join Algorithms for Spatial Databases,Incremental distance join algorithms for spatial databases,0.7017543859649122
39,1509925,conf/sigmod/GrumbachRS98,276324,The DEDALE System for Complex Spatial Queries,The DEDALE system for complex spatial queries,0.72
40,1511054,conf/sigmod/Miller98,276322,Using Schematically Heterogeneous Structures,Using schematically heterogeneous structures,0.8043478260869565
41,1513199,conf/sigmod/GriffinH97,253304,A Framework for Implementing Hypothetical Queries,A framework for implementing hypothetical queries,0.7115384615384616
42,1514262,conf/sigmod/CareyK97,253302,On Saying Enough Already! in SQL,On saying Enough already! in SQL,0.78125
43,1515679,conf/sigmod/Arpaci-DusseauACHP97,253322,High-Performance Sorting on Networks of Workstations,High-performance sorting on networks of workstations,0.7
44,1521281,conf/sigmod/ZhaoDN97,253288,An Array-Based Algorithm for Simultaneous Multidimensional Aggregates,An array-based algorithm for simultaneous multidimensional aggregates,0.7536231884057971
45,1523684,conf/sigmod/AcharyaFZ97,253293,Balancing Push and Pull for Data Broadcast,Balancing push and pull for data broadcast,0.7272727272727273
46,1523776,conf/sigmod/HellersteinHW97,253291,Online Aggregation,Online aggregation,0.7894736842105263
47,1526399,conf/sigmod/ColbyKLMR97,253353,Supporting Multiple View Maintenance Policies,Supporting multiple view maintenance policies,0.7111111111111111
48,1527794,conf/sigmod/LlirbatFS97,253357,Eliminating Costly Redundant Computations from SQL Trigger Executions,Eliminating costly redundant computations from SQL trigger executions,0.7538461538461538
49,1535233,conf/sigmod/PatelYKTNBHRLEKGDN97,253342,"Building a Scaleable Geo-Spatial DBMS: Technology, Implementation, and Evaluation","Building a scaleable geo-spatial DBMS: technology, implementation, and evaluation",0.7
50,1539723,conf/sigmod/HammerGNYBV97,253395,Template-Based Wrappers in the TSIMMIS System,Template-based wrappers in the TSIMMIS system,0.75
51,1543316,conf/sigmod/TomasicABKNR97,253402,The Distributed Information Search Component (Disco) and the World Wide Web,The distributed information search component (Disco) and the World Wide Web,0.8
52,1544299,conf/sigmod/BohrerBBCFHKKMNRRSUUW97a,253401,The InfoSleuth Project,The InfoSleuth Project,1.0
53,1545266,conf/sigmod/GingrasLSPS97,253397,Languages for Multi-database Interoperability,Languages for multi-database interoperability,0.8260869565217391
54,1549635,conf/sigmod/Shasha97,253368,"Lessons from Wall Street: Case Studies in Configuration, Tuning, and Distribution (Tutorial)","Lessons from Wall Street: case studies in configuration, tuning, and distribution",0.759493670886076
55,1551390,conf/sigmod/GoyalHKMSZ97,253377,Picture Programming Project,Picture programming project,0.8333333333333334
56,1553377,journals/tods/EiterGM97,261126,Disjunctive Datalog,Disjunctive datalog,0.8
57,1555414,journals/tods/FranklinCL97,261125,Transactional Client-Server Cache Consistency: Alternatives and Performance,Transactional client-server cache consistency: alternatives and performance,0.7272727272727273
58,1555964,journals/sigmod/ClementLGMK97,262765,OGDI: Toward Interoperability among Geospatial Databases,OGDI: toward interoperability among geospatial databases,0.7333333333333333
59,1559410,conf/sigmod/LabioZWGGW97,253405,The WHIPS Prototype for Data Warehouse Creation and Maintenance,The WHIPS prototype for data warehouse creation and maintenance,0.7076923076923077
60,1561157,conf/sigmod/WangSCRZP97,253406,Structural Matching and Discovery in Document Databases,Structural matching and discovery in document databases,0.7857142857142857
61,1563355,conf/sigmod/WodtkeWWDM97,253411,The MENTOR Workbench for Enterprise-wide Workflow Management,The MENTOR workbench for enterprise-wide workflow management,0.8181818181818182
62,1564268,conf/sigmod/BerchtoldK97,253407,S3: Similarity Search in CAD Database Systems,S3: similarity search in CAD database systems,0.7608695652173914
63,1564345,conf/sigmod/SeshadriP97,253408,PREDATOR: An OR-DBMS with Enhanced Data Types,PREDATOR: an OR-DBMS with enhanced data types,0.7
64,1567882,journals/sigmod/Dogac96,234900,Middle East Technical University Software Research and Development Center,Middle East Technical University Software Research and Development Center,1.0
65,1575759,journals/tods/Galindo-LegariaR97,244812,Outerjoin Simplification and Reordering for Query Optimization,Outerjoin simplification and reordering for query optimization,0.7241379310344828
66,1576201,journals/sigmod/Colliat96,234901,"OLAP, Relational, and Multidimensional Database Systems","OLAP, relational, and multidimensional database systems",0.7090909090909091
67,1579707,journals/sigmod/Ioannidis96,245890,Dynamic Information Visualization,Dynamic information visualization,0.75
68,1581979,journals/sigmod/TaninBS96,245891,Incremental data Structures and Algorithms for Dynamic Query Interfaces,Incremental data structures and algorithms for dynamic query interfaces,0.7681159420289855
69,1582336,journals/sigmod/Date96,245885,"A Response to R. Camps' Article ``Domains, Relations and Religious Wars''","A response to R. Camps' article Domains, relations and religious wars",0.7777777777777778
70,1584395,journals/sigmod/RafanelliBT96,245887,The Aggregate Data Problem: A System for their Definition and Management,The aggregate data problem: a system for their definition and management,0.7
71,1585274,journals/sigmod/Darwen96,245886,"In Reply to Domains, relations and Religious Wars","In reply to Domains, relations and religious wars",0.8636363636363636
72,1586538,journals/sigmod/ShethGJRSWW96,245903,Report from the NSF Workshop on Workflow and Process Automation in Information Systems,Report from the NSF workshop on workflow and process automation in information systems,0.7733333333333333
73,1587540,journals/sigmod/Sidell96,245906,The Mariposa Distributed Database Management System,The Mariposa distributed database management system,0.7551020408163265
74,1588727,journals/sigmod/AtkinsonDJPS96,245905,An Orthogonally Persistent Java,An orthogonally persistent Java,0.7647058823529411
75,1589416,journals/sigmod/Keim96,245896,Pixel-oriented Database Visualizations,Pixel-oriented database visualizations,0.8
76,1590213,journals/sigmod/KennedyMB96,245895,A Framework for Information Visualisation,A framework for information visualisation,0.7027027027027027
77,1590842,journals/sigmod/HasanMV96,245900,Applying database Visualization to the World Wide Web,Applying database visualization to the World Wide Web,0.9166666666666666
78,1593803,journals/sigmod/AbelTK97,248605,Integrating Modelling Systems for Environmental Management Information Systems,Integrating modelling systems for environmental management information systems,0.7666666666666667
79,1595133,journals/sigmod/Qian96b,245909,New Programs at DARPA and NSF,New programs at DARPA and NSF,0.8620689655172413
80,1596322,journals/sigmod/Eisenberg96,245907,New Standard for Stored Procedures in SQL,New standard for stored procedures in SQL,0.8108108108108109
81,1598087,journals/sigmod/RamanathanH97,248615,Extraction of Object-Oriented Structures from Existing Relational Databases,Extraction of object-oriented structures from existing relational databases,0.726027397260274
82,1598325,journals/sigmod/ChaudhuriD97,248616,An Overview of Data Warehousing and OLAP Technology,An overview of data warehousing and OLAP technology,0.75
83,1600349,journals/sigmod/Fong97,248614,Converting Relational to Object-Oriented Databases,Converting relational to object-oriented databases,0.7037037037037037
84,1603842,journals/sigmod/Gardels97,248610,Open GIS and On-Line Environmental Libraries,Open GIS and on-line environmental libraries,0.7391304347826086
85,1604916,conf/sigmod/BerchtoldBBKK97,253263,Fast Parallel Similarity Search in Multimedia Databases,Fast parallel similarity search in multimedia databases,0.7017543859649122
86,1608750,journals/tods/WangBBJ97,249979,Logical Design for Temporal Databases with Multiple Granularities,Logical design for temporal databases with multiple granularities,0.7142857142857143
87,1609087,journals/sigmod/Qian97,248618,Opportunities in Information Management and Assurance,Opportunities in information management and assurance,0.8367346938775511
88,1614248,conf/sigmod/KornackerMH97,253272,Concurrency and Recovery in Generalized Search Trees,Concurrency and recovery in generalized search trees,0.7115384615384616
89,1615841,conf/sigmod/ZaharioudakisC97,253269,Highly Concurrent Cache Consistency for Indices in Client-Server Database Systems,Highly concurrent cache consistency for indices in client-server database systems,0.7162162162162162
